Trò Khỉ$Tập 8 Vietsub$Đang cập nhật$51 phút/tập$10 Tập$Vietsub$2024$Âu Mỹ$Hài Hước, Hình Sự$Trò Khỉ - Bad Monkey (2024) Full VietSub HD Trò Khỉ Một thanh tra nhà hàng vốn từng là điều tra viên ở Nam Florida bị cuốn vào thế giới đầy lòng tham và sự tham nhũng sau khi một du khách tìm thấy một cánh tay bị đứt lìa khi đang câu cá. Và vâng, có một con khỉ.$https://motchillti.net/phim/tro-khi-411156.html
Sinh Vật Gyeongseong 2$Full 07/07 VietSub$Jung Dong Yoon$65 phút/ tập$7 Tập$VietSub$2024$Hàn Quốc$Hành Động, Viễn Tưởng, Phiêu Lưu, Khoa Học, Chính kịch, Bí ẩn, Tình Cảm, Tâm Lý$Sinh Vật Gyeongseong 2 - Gyeongseong Creature S2 (2024) Full VietSub HD Ở Gyeongseong năm 1945, giữa thời kỳ Seoul bị thực dân thống trị, một doanh nhân và một do thám chiến đấu để sinh tồn và đối mặt với quái vật sinh ra từ lòng tham của con người.$https://motchillti.net/phim/sinh-vat-gyeongseong-2-96599.html
Hội Sát Nhân Đọc Sách$Full Vietsub$Carlos Alonso-Ojea$89 Phút$1$Vietsub$2023$Tây Ban Nha$Kinh Dị$Hội Sát Nhân Đọc Sách - Killer Book Club (2023) Full VietSub HD Tám người bạn mê kinh dị phải chiến đấu giữ mạng khi một gã hề sát nhân dường như biết được bí mật chung đầy nghiệt ngã của họ và bắt đầu ra tay với từng người một.$https://motchillti.net/phim/hoi-sat-nhan-doc-sach.html
Mr. McMahon$Full 06/06 Vietsub$Đang cập nhật$51 phút/tập$6 Tập$Vietsub$2024$Âu Mỹ$Tài Liệu$Mr. McMahon - Mr. McMahon (2024) Full VietSub HD WWE trải qua những nốt thăng phá kỷ lục và cả những nốt trầm thảm hại dưới sự lãnh đạo của Vince McMahon. Loạt phim tài liệu này đào sâu triều đại gây tranh cãi của ông trùm này.$https://motchillti.net/phim/mr-mcmahon.html
Hoa Học Đường$Full 06/06 Vietsub$Đang cập nhật$20 Phút / Tập$6 Tập$Vietsub$2024$Hàn Quốc$Tình Cảm, Học Đường$Hoa Học Đường - lossom Campus (2024) Full VietSub HD Hoa Học Đường - Blossom Campus (2024): Bộ phim kể về Kim Min Jae, một sinh viên chuyển trường chuyên ngành Âm nhạc thực hành và làm việc bán thời gian tại thư viện, và Yoon Chan, một sinh viên chuyên ngành Taekwondo đã giúp anh. Kể từ lần gặp gỡ đầu tiên, cả hai đã trở nên gắn bó và gần gũi hơn, dẫn đến việc họ phát triển một mối quan hệ lãng mạn.$https://motchillti.net/phim/hoa-hoc-duong.html
Màn Thứ Hai$Full Vietsub$Quentin Dupieux$85 phút$Full$Vietsub$2024$Pháp$Hài Hước$Màn Thứ Hai - The Second Act (2024) Full VietSub HD Florence muốn giới thiệu David, người đàn ông mà cô yêu điên cuồng, với cha cô là Guillaume. Nhưng David không bị Florence thu hút và muốn ném cô vào vòng tay của người bạn Willy. Bốn nhân vật gặp nhau tại một nhà hàng ở giữa hư không.$https://motchillti.net/phim/man-thu-hai.html
Rồng Đen: Võ Đài Sinh Tử$Full Vietsub$John R. Leonetti$95 phút$Full$Vietsub$1997$Âu Mỹ$Hành Động, Viễn Tưởng$Rồng Đen: Võ Đài Sinh Tử - Mortal Kombat: Annihilation (1997) Full VietSub HD Sau sự ra mắt của phần 1 được ra mắt năm 1995, bộ phim Rồng Đen 1 được tiếp nối nội dung với phần 2 ra mắt năm 1997 bởi đạo diễn John R. Leonetti, những diễn biến mới của Rồng Đen 2 đưa chúng ta tới những câu chuyện vừa cũ vừa mới đầy kịch tính cùng nhiều màn hành động, đấu võ mãn nhãn. Ở phần này, Liu Kang (Robin Shou) sẽ là tâm điểm của cuộc chiến, giữa bóng tối và ánh sáng ai sẽ là người chiến thắng và liệu rằng nhân loại có được cứu khỏi sự diệt vong, mọi thứ sẽ có trong Mortal Kombat: Annihilation. Được đầu tư 30 triệu USD, bộ phim hứa hẹn mang lại những thước phim ấn tượng nhất về những nhân vật huyền thoại đi ra từ trong game.$https://motchillti.net/phim/rong-den-vo-dai-sinh-tu.html
Wrongful Death$Full Vietsub$Vjekoslav Katušin$86 phút$Full$Vietsub$2023$Đức$Tâm Lý, Bí ẩn$Wrongful Death - Wrongful Death (2023) Full VietSub HD Bị bắt trong bóng tối của căn phòng được thiết kế kỳ lạ, một nhà báo tự ái và một người phụ nữ tội lỗi xấu tính học được một cách khó khăn rằng sự thật không thể bị chôn vùi mãi mãi và những gì bắt đầu khá vô hại, kết thúc bằng một trò chơi cuộc sống và ...$https://motchillti.net/phim/wrongful-death.html
Vùng Đất Hạnh Phúc$Full Vietsub$Choo Chang Min$124 Phút$1 Tập$Vietsub$2024$Hàn Quốc$Tâm Lý, Chính kịch$Vùng Đất Hạnh Phúc - Land of Happiness (2024) Full VietSub HD$https://motchillti.net/phim/vung-dat-hanh-phuc-956663.html
Nàng Công Chúa Ở Thung Lũng Gió$Full Vietsub$宮崎駿$117 phút$Full$Vietsub$1984$Nhật Bản$Phiêu Lưu, Viễn Tưởng$Nàng Công Chúa Ở Thung Lũng Gió - Nausicaä of the Valley of the Wind (1984) Full VietSub HD Khi tài nguyên thiên nhiên của hành tinh bị hủy hoại, công chúa chiến binh Nausicaa tập hợp thần dân của mình chống lại đội quân hung tàn của nữ hoàng độc ác.$https://motchillti.net/phim/nang-cong-chua-o-thung-lung-gio.html
Trường An Bí Văn Lục: Nhiếp Ẩn Nương$Full Vietsub$Vương Dĩnh$85 phút$Full$Vietsub$2024$Trung Quốc$Hành Động, Cổ Trang$Trường An Bí Văn Lục: Nhiếp Ẩn Nương - A LOVE STORY OF ASSASSIN (2024) Full VietSub HD Trong giang hồ có một môn phái bí ẩn tên là Vụ Ẩn. Nhiếp Ẩn Nương là người có võ công đứng đầu trong Vụ Ẩn. Sư phụ Diệu Huệ Thần Ni giao cho Nhiếp Ẩn Nương một nhiệm vụ, đó là ám sát thương nhân giàu có Lưu Trường Nghĩa. Nhiếp Ẩn Nương dễ dàng hoàn thành nhiệm vụ, nhưng lại bị cuốn vào một âm mưu và qua đó gặp gỡ Thiếu khanh của Đại lý tự là Tư Mã Sinh An. Trong quá trình điều tra vụ án, hai người dần nảy sinh tình cảm và cùng nhau tìm ra chân tướng đằng sau âm mưu này.$https://motchillti.net/phim/truong-an-bi-van-luc-nhiep-an-nuong.html
Apollo 13: Sống sót$Full Vietsub$Pete Middleton$98 Phút$Full$Vietsub$2024$Anh$Tài Liệu$Apollo 13: Sống sót - Apollo 13: Survival (2024) Full VietSub HD Sử dụng các thước phim và cuộc phỏng vấn nguyên gốc, bộ phim tài liệu này kể câu chuyện gay cấn về tàu Apollo 13 và hành trình khó khăn để đưa các phi hành gia trở về nhà an toàn.$https://motchillti.net/phim/apollo-13-song-sot.html
Mưa Thuận Gió Hoà$Full 32/32 VietSub$Đang cập nhật$45 phút/tập$32 Tập$VietSub$2024$Trung Quốc$Tình Cảm, Chính kịch, Tâm Lý, Gia Đình, Học Đường$"Mưa Thuận Gió Hoà - Sowers of Hope (2024) Full VietSub HD Năm 2002, An Nhan vừa tốt nghiệp và được phân về dạy học tại trường trung học Hòa Bình thuộc huyện Trường Trị. Là người sinh ra và lớn lên ở thành phố nên ban đầu cô khó thích nghi với môi trường và quan niệm giáo dục của trường học nông thôn. Nhưng sau khi tiếp xúc với học sinh và tìm hiểu sâu hơn về gia đình, An Nhan dần nhận ra tầm quan trọng của giáo dục nông thôn và cảm nhận được giá trị của việc ""được cần đến"". Dưới sự khích lệ của hiệu trưởng cũ là Vu Điền và hiệu trưởng đương nhiệm là Phù Thắng Trị, cô đã thấu hiểu và tiếp nối triết lý giáo dục ""giữ gìn"" và ""ấp ủ"", trở thành một giáo viên xuất sắc nổi tiếng gần xa. Năm 2012, An Nhan được bổ nhiệm làm phó hiệu trưởng phụ trách việc hậu cần của trường trung học Hòa Bình, thúc đẩy chương trình ""Bữa trưa dinh dưỡng"" đi vào thực hiện. Năm 2016, An Nhan được bổ nhiệm làm hiệu trưởng trường học di dân tái định cư, giúp đỡ người nghèo. Đối mặt với nền tảng giảng dạy yếu kém và tình hình học sinh phức tạp, An Nhan đã dẫn dắt một đội ngũ giáo viên nông thôn ưu tú giải quyết từng vấn đề, tạo ra môi trường học tập chất lượng cho các em. Những giáo viên nông thôn, đại diện là An Nhan vẫn luôn không ngừng cống hiến, cần mẫn truyền dạy tri thức, giúp từng thế hệ học sinh vùng núi đi tới những chân trời rộng lớn hơn."$https://motchillti.net/phim/mua-thuan-gio-hoa-7489696.html
Tôi Sẽ Đỡ Hết Mọi Thứ: Người Mạnh Nhất Thế Giới Với Hiểu Lầm Ngược Đời Muốn Làm Mạo Hiểm Giả$Tập 11 VietSub$Đang cập nhật$30 phút/tập$12 Tập$VietSub$2024$Nhật Bản$Hoạt Hình$Tôi Sẽ Đỡ Hết Mọi Thứ: Người Mạnh Nhất Thế Giới Với Hiểu Lầm Ngược Đời Muốn Làm Mạo Hiểm Giả - Ore wa Subete wo Parry suru: Gyaku Kanchigai no Sekai Saikyou wa Boukensha ni Naritai, I Parry Everything, I Will Parry All: The World's Strongest Man Wanna Be an Adventurer, I Parry Everything: What Do You Mean I'm the Strongest? I'm Not Ev (2024) Full VietSub HD  Tôi Sẽ Đỡ Hết Mọi Thứ: Người Mạnh Nhất Thế Giới Với Hiểu Lầm Ngược Đời Muốn Làm Mạo Hiểm Giả Vương quốc Clays phải đối mặt với một khủng hoảng nghiêm trọng: Có kẻ muốn ám sát Công chúa Lynneburg, còn các nước láng giềng thì luôn nhăm nhe xâm lược... nhưng Noor không biết gì về điều này. Trở lại thủ đô hoàng gia sau mười năm luyện tập tại nhà trên núi, anh quyết tâm sẽ thực hiện được ước mơ trở thành Mạo hiểm giả của mình. Con đường của vị anh hùng vẫn còn dài và gian khổ, nhưng nếu có điều gì mà Noor không hề sợ, đó sẽ là sự cố gắng không ngừng.$https://motchillti.net/phim/toi-se-do-het-moi-thu-nguoi-manh-nhat-the-gioi-voi-hieu-lam-nguoc-doi-muon-lam-mao-hiem-gia-4879969.html
Liễu Chu Ký (Kiều Tàng)$Full 40/40 Thuyết Minh$Lưu Quốc Nam, Tùng Hiểu$45 phút/tập$40 Tập$Thuyết Minh$2024$Trung Quốc$Tình Cảm, Chính kịch, Cổ Trang$Liễu Chu Ký (Kiều Tàng) - Hidden Charm (2024) Full VietSub HD Liễu Chu Ký được chuyển thể từ tiểu thuyết Kiều Tàng của tác giả Cuồng Thượng Gia Cuồng. Câu chuyện kể về Liễu Miên Đường (Vương Sở Nhiên) là con gái của một gia đình quan lại sa sút. Cô bị bắt ép gả vào kinh thành. Giữa đường đi, Liễu Miên Đường bị cướp dâu và trở thành vợ của một tên đạo tặc. Sau một biến cố, Liễu Miên Đường mất trí nhớ nên nhầm tưởng Thôi Hành Chu (Trương Vãn Ý) là chồng mình. Dù biết rõ mọi chuyện nhưng Thôi Hành Chu vẫn đóng giả thương nhân bán đồ sứ, làm “chồng hờ” của Liễu Miên Đường, lợi dụng cô cho mục đích riêng.$https://motchillti.net/phim/lieu-chu-ky-kieu-tang.html
Bõa Cát$Full 32/32 Vietsub$Đang cập nhật$43 phút/tập$Full 32/32$Vietsub$2006$Trung Quốc, Hồng Kông$Chính kịch$Bõa Cát - The Dance of Passion (2006) Full VietSub HD With almost the same cast and crew as War And Beauty, And the extensive location filming in Yinchuan, The Dance Of Passion is going to be another great legend in TV history! Across the Loess Plateau… Is a story of family feuds and furtive passions! On the Loess Plateau of Shanbei live two clans, the YIMs and the SUNGs. The SUNGs have been relying on the YIMs and a lasting peace has been going on for three generations. But this situation cannot continue when YIM MAN-HEI (LAM, BOWIE) becomes the Superintendent. His rise to power has drawn the clans into serious conflict. SUNG TUNG-SING (CHAN HO, MOSES) who falls in love with a widow has suffered the cruelest punishment, the Penalty of Torching, for his affair, as ordered by HEI. SING’s lover is burnt to death while SING is expelled from YIM’s clan...$https://motchillti.net/phim/boa-cat.html
Tình yêu trên phổ tự kỷ 2$Full 07/07 Vietsub$Đang cập nhật$44phút/tập$7 tập$Vietsub$2021$Úc$Tài Liệu$Tình yêu trên phổ tự kỷ 2 - Love on the Spectrum Season 2 (2021) Full VietSub HD Trên hành trình đi tìm nửa kia hoàn hảo, bảy bạn trẻ mắc chứng rối loạn phổ tự kỷ cả mới lẫn cũ của chương trình dấn thân vào thế giới hẹn hò.$https://motchillti.net/phim/tinh-yeu-tren-pho-tu-ky-2.html
Thanh tra Forst$Full 06/06 Vietsub$Đang cập nhật$45 phút/tập$Full 06/06$Vietsub$2024$Ba lan$Bí ẩn$Thanh tra Forst - Detective Forst (2024) Full VietSub HD Khi cách thức điều tra bất tuân luật lệ khiến thanh tra nọ bị đình chỉ, anh bắt tay với một nhà báo để phá giải hàng loạt án mạng tàn bạo ngoài vòng pháp luật.$https://motchillti.net/phim/thanh-tra-forst.html
Biệt Đội Cảm Tử Tại Dị Giới$Full 10/10 VietSub$Đang cập nhật$24 phút/tập$10 Tập$VietSub$2024$Nhật Bản, Âu Mỹ$Hành Động, Viễn Tưởng, Phiêu Lưu, Khoa Học, Hoạt Hình$Biệt Đội Cảm Tử Tại Dị Giới - Suicide Squad Isekai (2024) Full VietSub HD$https://motchillti.net/phim/biet-doi-cam-tu-tai-di-gioi-458969.html
Bách Yêu Phổ 4$tập 12 Vietsub$Đang cập nhật$23 phút/tập$? tập$Vietsub$2024$Trung Quốc$Tình Cảm$Bách Yêu Phổ 4 - 百妖谱 第四季 (2024) Full VietSub HD Bách Yêu Phổ Phần 4$https://motchillti.net/phim/bach-yeu-pho-4.html
Bằng Chứng Thép 6$Full 24/24 Lồng Tiếng$Âu Diệu Kiệt, Trương Tuấn Hào$45 phút/tập$24 Tập$Lồng Tiếng$2024$Trung Quốc, Hồng Kông$Chính kịch, Phiêu Lưu, Bí ẩn, Hình Sự$Bằng Chứng Thép 6 - Forensic Heroes VI: Redemption (2024) Full VietSub HD Bằng Chứng Thép 6 Chuyên gia pháp chứng Dư Tinh Bách (do Huỳnh Tông Trạch đóng), cảnh sát trọng án Tỉnh Hạo Nhiên (do Viên Vỹ Hào đóng) và pháp y Phạm Bội Thanh (do Thái Khiết đóng) – bộ ba “tam giác thép” chỉ tin sự thật và chân tướng mà khoa học giải thích được. Thế nhưng, con đường tình yêu của họ lại gặp nhiều trắc trở, mà khoa học không thể lý giải. Vợ của Tinh Bách là Hoắc Bảo Anh (do Vương Mẫn Dịch đóng) bỗng nhiên mất tích khi hưởng tuần trăng mật tại Nhật; vị hôn thê sắp cưới của Hạo Nhiên là Đàm Thiến Văn (do Thái Tư Bối đóng) đột nhiên chia tay và bỏ đi; Bội Thanh gặp Tiển Dương (do Quan Sở Diệu đóng) – người có gương mặt y hệt sát thủ biến thái đã chết Đổng Ứng Vĩ. Cả ba đều bị chìm đắm trong nỗi khổ vì tình.$https://motchillti.net/phim/bang-chung-thep-6-78545.html
Khu Rừng Tuổi Thơ$Full Thuyết Minh$Yim Soon-rye$99 phút$1 Tập$Thuyết Minh$2018$Hàn Quốc$Tâm Lý, Gia Đình$Khu Rừng Tuổi Thơ - Little Forest (2018) Full VietSub HD Hae Won cảm thấy mệt mỏi với cuộc sống khó khăn ở thành phố và chuyển về quê nhà ở vùng nông thôn. Tại đây, Hae Won đã có thể chữa lành vết thương lòng nhờ hòa mình vào cảnh vật yên bình nơi đây và đặc biệt là nhờ có sự giúp đỡ của những người bạn mới.$https://motchillti.net/phim/khu-rung-tuoi-tho.html
Cặp Đôi Hoàn Hảo 1$Full 06/06 Vietsub$Susanne Bier$45 Phút/Tập$6 Tập$Vietsub$2024$Âu Mỹ$Chính kịch, Hình Sự$Cặp Đôi Hoàn Hảo 1 - The Perfect Couple season 1 (2024) Full VietSub HD Amelia sắp được gả vào một trong những gia đình giàu có nhất ở Nantucket. Nhưng rồi cái chết động trời phá hỏng đám cưới ấy và biến mọi người thành nghi phạm.$https://motchillti.net/phim/cap-doi-hoan-hao-1.html
Kế Hoạch Đào Tẩu 2: Địa Ngục$Full VietSub$Steven C. Miller$1 giờ 30phút$1 Tập$VietSub$2018$Trung Quốc, Anh, Âu Mỹ$Phiêu Lưu, Hành Động, Bí ẩn$Kế Hoạch Đào Tẩu 2: Địa Ngục - Escape Plan 2: Hades (2018) Full VietSub HD Sau phần 1 được ra mắt năm 2013 nhận được sự chú ý của khán giả và giới chuyên môn, phần 2 của Escape Plan tiếp tục có nội dung xoay quanh chuyên gia bảo mật Ray Breslin. Anh là một bậc thầy trong việc cài đặt hệ thống an ninh cho các nhà tù liên bang và cũng là người “thử vượt ngục” tại các nhà tù cũ kỹ, nơi mà các nhà chức trách luôn tự hào là chốn không thể xâm phạm.$https://motchillti.net/phim/ke-hoach-dao-tau-2-dia-nguc-8848969.html
Kế Hoạch Đào Tẩu$Full Vietsub$Đang cập nhật$1 giờ 30phút$1 Tập$Vietsub$2013$Âu Mỹ$Hành Động, Kinh Dị$Kế Hoạch Đào Tẩu - Escape Plan (2013) Full VietSub HD$https://motchillti.net/phim/ke-hoach-dao-tau.html
Kế hoạch đào tẩu 3: Giải cứu$Full Vietsub$Đang cập nhật$1g 36ph$1 Tập$Vietsub$2019$Âu Mỹ$Hành Động, Phiêu Lưu$Kế hoạch đào tẩu 3: Giải cứu - Escape Plan: The Extractors (2019) Full VietSub HD$https://motchillti.net/phim/ke-hoach-dao-tau-3-giai-cuu.html
Dhevaprom: Poncheewan$Full 14/14 VietSub$King Somching Srisupap$45 phút/tập$14 Tập$VietSub$2024$Thái Lan$Tình Cảm, Chính kịch, Tâm Lý$Dhevaprom: Poncheewan - ดวงใจเทวพรหม: พรชีวัน (2024) Full VietSub HD Hai chị em họ xinh đẹp và tươi sáng của gia tộc Dhevaprom—Cheewan và Poncheewa—gắn bó như chị em ruột và luôn làm mọi việc cùng nhau, bao gồm cả việc học tại Thụy Sĩ. Trong khi đó, M.L. Saruj Juthathep, con trai của M.R. Pavornruj và Công chúa Wanrasa, là Bí thư thứ nhất của Đại sứ quán Thái Lan tại Bern, người có nhiệm vụ hỗ trợ các sinh viên Thái Lan. Đây là bối cảnh hoàn hảo cho một câu chuyện tình lãng mạn, nhưng không phải là một mối tình tay ba. Mọi thứ trở nên phức tạp khi Cheewan phải lòng Saruj, trong khi cô vốn dĩ đang giúp mai mối cho Poncheewa và Saruj. Họ vướng vào một mạng lưới dối trá và ghen tuông, đe dọa phá vỡ mối quan hệ khăng khít không gì có thể chia cắt giữa hai chị em họ. Liệu Cheewan có nghe theo tiếng gọi con tim và đến với Saruj, hay cô sẽ trung thành với Poncheewa? Và Saruj thật sự dành tình cảm cho ai?$https://motchillti.net/phim/dhevaprom-poncheewan-795548.html
Chưởng Giáo Tông Môn Ẩn Thế$Full 52/52 VietSub$Đang cập nhật$30 phút/tập$52 Tập$VietSub$2024$Trung Quốc$Hoạt Hình$"Chưởng Giáo Tông Môn Ẩn Thế - Yin Shi Zong Men Zhang (2024) Full VietSub HD Giang Bắc Thần xuyên không tới thế giới huyền huyễn, ngẫu nhiên có được hệ thống chưởng giáo mạnh nhất, thành lập nên ""Tiên Đạo Môn"". Ban đầu Giang Bắc Thần chỉ có thể giả dạng phong thái cao nhân, lừa lọc Khí Vận Chi Tử để thăng cấp tông môn, nhưng sau này hắn dần dần phát hiện tông môn nhỏ của mình lại thật sự trở thành ẩn thế tông môn đứng trên đỉnh kim tự tháp."$https://motchillti.net/phim/chuong-giao-tong-mon-an-the-688789.html
Kono Sekai wa Fukanzen Sugiru$Tập 10 VietSub$Đang cập nhật$30 phút/tập$13 Tập$VietSub$2024$Nhật Bản$Hoạt Hình$Kono Sekai wa Fukanzen Sugiru - Quality Assurance in Another World (2024) Full VietSub HD Kono Sekai wa Fukanzen Sugiru Nikola chỉ là một cô gái bình thường làm việc tại quán trọ cho đến ngày lũ rồng xâm chiếm, cô gặp và được cứu bởi Haga, một người có sứ mệnh nghiên cứu gì đó. Tuy vậy thứ mà cô không biết chính là Nikola chỉ là NPC trong một tựa game mà Haga có nhiệm vụ làm QA (chơi thử để tìm bug, lỗi) và thế là vô số tình huống dở khóc dở cười diễn ra sau đó.$https://motchillti.net/phim/kono-sekai-wa-fukanzen-sugiru-76969.html
Vương Hậu Margot$Full Vietsub$Patrice Chéreau$138 phút$Full$Vietsub$1994$Pháp$Chính kịch$Vương Hậu Margot - Queen Margot (1994) Full VietSub HD Tháng 8 năm 1572, tín đồ đạo tin lành Henri de Navarre, vua Henri IV tương lai, chuẩn bị cưới Margot, tín đồ công giáo, con gái của Catherine de Médicis, em gái của vua Charles IX hiện thời, cả hai đều không yêu thương nhau vì đó là một cuộc hôn nhân chính trị được giật dây bởi Catherine de Médicis nhằm giảm bớt những xung đột giữa các tín đồ Công giáo và Tin lành, phân chia ranh giới giữa hai đạo giáo. Với cơ hội này, vua của Navarre và đô đốc Coligny triệu tập tất cả các lãnh đạo của Tin lành ở Paris để ăn mừng sự kiện. Dù không yêu thương nhau nhưng Margot vẫn trung thành với chồng và sự trung thành của cô đã được minh chứng khi cô bảo vệ mạng sống của chồng trong đêm diễn ra vụ tàn sát Saint-Barthélémy chỉ 6 ngày sau lễ cưới khi vua Charle IX ra lệnh giết hết tất cả tín đồ Tin lành có mặt ở Paris ngoại trừ vua của Navarre và hoàng tử của Condé.$https://motchillti.net/phim/vuong-hau-margot.html
Ác Quỷ Sàn Catwalk$Full Vietsub$Nicolas Winding Refn$106 phút$1$Vietsub$2016$Âu Mỹ$Tâm Lý$Ác Quỷ Sàn Catwalk - The Neon Demon (2016) Full VietSub HD$https://motchillti.net/phim/ac-quy-san-catwalk.html
Four-Panel Heroes$Full 10/10 Vietsub$Đang cập nhật$10 phút/tập$Full 10/10$Vietsub$2022$Trung Quốc$Hài Hước, Viễn Tưởng$Four-Panel Heroes - 四格勇者 (2022) Full VietSub HD Four-Panel Heroes$https://motchillti.net/phim/four-panel-heroes.html
Chiến Lược Hôn Nhân$Full 16/16 Vietsub$Đang cập nhật$35 phút/tập$16 Tập$Vietsub$2024$Trung Quốc$Tình Cảm, Tâm Lý$Chiến Lược Hôn Nhân - We All Lie (2024) Full VietSub HD Biên kịch nổi tiếng Tô Ly và đạo diễn nổi danh Trương Thư Hằng có với nhau một cuộc hôn nhân nhiều người ngưỡng mộ, nhưng khi sống trong hạnh phúc Tô Ly lại nhận được một lá thư nặc danh, nói rằng Trương Thư Hằng đang ngoại tình. Với việc liên tục điều tra, cuối cùng Tô Ly xác định được sự thật rằng chồng cô đã lừa dối cô và phát hiện ra rằng người anh ta ngoại tình cùng lại là người bạn thân nhất của cô trong nhiều năm. Đối mặt với sự phản bội của cả tình bạn và tình yêu, Tô Ly đau khổ vô cùng. Vôn là người yêu ghét rõ ràng, cô quyết định ly hôn ngay lập tức. Tuy nhiên, sau khi hỏi ý kiến ​​​​luật sư, cô phát hiện ra rằng Trương Thư Hằng gần như không có tài sản đứng tên mình do thất bại trong đầu tư trước đây. Nếu ly hôn, Tô Ly sẽ phải chia một nửa tài sản của mình cho Trương Thư Hằng. Không thể chấp nhận điều này, Tô Ly quyết định giả vờ không biết chuyện ngoại tình và hoãn việc ly hôn cho đến khi chuẩn bị xong mọi thủ tục ly hôn.$https://motchillti.net/phim/chien-luoc-hon-nhan-172493331593111.html
Dìdi$Full Vietsub$Sean Wang$94 phút$Full$Vietsub$2024$Âu Mỹ$Hài Hước, Chính kịch$Dìdi - 弟弟 (2024) Full VietSub HD Didi Dìdi 2024 là một bộ phim Mỹ thuộc thể loại hài kịch-drama lấy bối cảnh cuối mùa hè năm 2008, trước khi một cậu bé Mỹ gốc Đài 13 tuổi bắt đầu vào trung học. Trong phim cậu bé học được những bài học về cuộc sống mà gia đình không thể dạy bao gồm cách trượt ván, tán tỉnh và yêu thương mẹ mình. Đây là bộ phim đầu tay của đạo diễn Sean Wang với chủ đề lứa tuổi teen sắp trưởng thành với một cái nhìn mới mẻ và sâu sắc, kết hợp giữa nghệ thuật và giải trí.$https://motchillti.net/phim/didi.html
Bye-Bye, Earth$Tập 9 VietSub$Đang cập nhật$30 phút/tập$$VietSub$2024$Nhật Bản$Hoạt Hình$"Bye-Bye, Earth - ばいばい、アース (2024) Full VietSub HD  Bye-Bye, Earth Trong thế giới tồn tại những động vật hình người, Belle Lablac là con người duy nhất được sinh ra. Không có răng nanh, lông, hay vảy, cậu bị gọi là ""Faceless"" và sống một cuộc đời cô độc vì không có ai có thể đồng cảm với mình. ""Tôi muốn trở thành một phần của thế giới này..."" Với niềm khao khát đó trong lòng, cậu quyết định lên đường tìm kiếm nguồn gốc của mình, mang theo một thanh đại kiếm cao bằng cô, Runding. Không biết có bao nhiêu thử thách đang chờ đợi cô trên hành trình này..."$https://motchillti.net/phim/bye-bye-earth-796663.html
