Wistoria: Trượng và Kiếm$Tập 10 Vietsub$Đang cập nhật$24 phút/tập$? Tập$Vietsub$2024$Nhật Bản$Hành Động, Phiêu Lưu, Hoạt Hình$Wistoria: Trượng và Kiếm - Wistoria: Wand and Sword (2024) Full VietSub HD Will là một cậu bé bước vào học viện ma pháp với mục tiêu trở thành một ma pháp sư. Tuy là một người chăm chỉ thế nhưng cậu có một điểm yếu chết người đó là không thể sử dụng ma pháp. Nhận lại những cái nhìn lạnh lùng của các giáo viên và những bạn bè trong trường nhưng Will không bỏ cuộc mà vẫn hướng về phía trước. Ngay cả khi không thể sử dụng trượng, cậu vẫn cầm thanh kiếm trên tay chiến đấu theo cách riêng của mình trong một thế giới nơi ma pháp là tối cao. Tin vào sức mạnh của bản thân và để giữ lời hứa với người mình yêu quý.$https://motchillti.net/phim/wistoria-truong-va-kiem-256933.html
Kamen Rider Gavv$Tập 4 Vietsub$Teruaki Sugihara$25 phút/tập$24 tập$Vietsub$2024$Nhật Bản$Phiêu Lưu, Hành Động, Viễn Tưởng$"Kamen Rider Gavv - Snacks and Evil, I'll eat them up!!!! (2024) Full VietSub HD Granute là một dạng sống thông minh hoạt động bí mật trong thế giới loài người. Chúng bắt cóc mọi người để tìm kiếm ""Kẹo chợ đen"". Mọi người liên tục bị Granute tấn công. Shoma, một chàng trai trẻ từ thế giới khác, đã đứng lên cứu mọi người. Cùng với Gochizo, một con quái vật nhỏ sinh ra từ việc ăn kẹo, anh biến thành Kamen Rider Gavv với một chiếc thắt lưng giống như miệng."$https://motchillti.net/phim/kamen-rider-gavv.html
Fairy Tail: Nhiệm Vụ 100 Năm$Tập 12 Vietsub$Đang cập nhật$24 phút/tập$25 Tập$Vietsub$2024$Nhật Bản$Hành Động, Phiêu Lưu, Hoạt Hình$Fairy Tail: Nhiệm Vụ 100 Năm - FAIRY TAIL 100 YEARS QUEST (2024) Full VietSub HD Fairy Tail: Nhiệm Vụ 100 Năm Một năm sau khi hội Fairy Tail vượt qua được thế lực ma quỷ của Acnologia và Zeref, Nats và nhóm của mình hành trình đến lục địa phía bắc Guiltina, nơi họ tìm kiếm chủ nhân của Nhiệm vụ 100 năm và nhận được nhiệm vụ gần như bất khả thi: phong ấn Ngũ Long Thần—một nhóm cá nhân có sức mạnh to lớn đến mức nếu để yên có thể gây ra sự tàn phá toàn cầu. Trong khi đó, một thành viên mới đầy nghị lực tên là Touka được tuyển vào Fairy Tail. Mặc dù năng lượng sôi nổi và bản chất đam mê khiến cô ấy trở thành người hoàn hảo cho hội, nhưng dường như cô ấy có nhiều điều hơn những gì bạn thấy.$https://motchillti.net/phim/fairy-tail-nhiem-vu-100-nam-869699.html
Tiên Nghịch$Tập 55 VietSub$Đang cập nhật$30 phút/tập$76 Tập$VietSub$2023$Trung Quốc$Hoạt Hình$"Tiên Nghịch - Renegade Immortal, Xian Ni (2023) Full VietSub HD  Tiên Nghịch Cuộc hành trình của Vương Lâm, một thiếu niên bình thường trở thành một trong những tu sĩ mạnh mẽ nhất trong thế giới tiên hiệp.Vương Lâm, một thiếu niên may mắn, bị cuốn vào thế giới pháp thuật và tu tiên của nước Triệu. Ban đầu, hắn thiếu linh căn và không có tri thức về thế giới này. Tuy nhiên, một hiểu lầm tai hại và một khối thiết tinh bí ẩn đã thay đổi cuộc đời của Vương Lâm mãi mãi. Hắn nhận được một ""Thần Bí Hạt Châu,"" một sự hỗ trợ quý báu trong việc trở thành một tu sĩ mạnh mẽ.Con đường tu tiên của Vương Lâm không hề trải phẫu thuật. Hắn phải đối mặt với những thử thách đầy khó khăn và hiểm nguy, chiến đấu với các thế lực tà ác, và khám phá những bí ẩn sâu thẳm về thế giới tiên hiệp. Cuộc hành trình này không chỉ là về sức mạnh vật lý, mà còn về sự trưởng thành, trí tuệ, và lòng dũng cảm trong trái tim của Vương Lâm."$https://motchillti.net/phim/tien-nghich-74588.html
Leo$Full Vietsub$Robert Smigel, Robert Marianetti, David Wachtenheim$102 phút$Full$Vietsub$2023$Âu Mỹ, Úc$Hài Hước, Gia Đình$Leo - Leo (2023) Full VietSub HD Adam Sandler là chú thằn lằn mang tên Leo trong bộ phim hài ca nhạc dành cho lứa tuổi mới lớn này. Bộ phim xoay quanh năm cuối cấp tiểu học qua góc nhìn từ chú thú kiểng của lớp.$https://motchillti.net/phim/leo.html
Kết Thúc Có Hậu$Full Vietsub$Joosje Duk$93 phút$Full$Vietsub$2023$Quốc Gia Khác$Tình Cảm, Hài Hước$Kết Thúc Có Hậu - Happy Ending (2023) Full VietSub HD Sau khi yêu đương hạnh phúc được một năm, Luna đề nghị thêm một người thứ ba vào đời sống tình dục. Điều này khiến mối gắn kết của cô với Mink bị đảo lộn.$https://motchillti.net/phim/ket-thuc-co-hau.html
Họ Nhân Bản Tyrone$Full Vietsub$Juel Taylor$122 phút$Full$Vietsub$2023$Âu Mỹ$Hài Hước, Bí ẩn, Viễn Tưởng$Họ Nhân Bản Tyrone - They Cloned Tyrone (2023) Full VietSub HD Một chuỗi sự kiện kỳ lạ khiến bộ ba bất đắc dĩ (John Boyega, Teyonah Parris và Jamie Foxx) vướng vào một âm mưu nham hiểm ở khu phố.$https://motchillti.net/phim/ho-nhan-ban-tyrone.html
Một Ngày Nào Đó Chúng Ta Sẽ Kể Cho Nhau Mọi Điều$Full Vietsub$Emily Atef$129 phút$Full$Vietsub$2023$Đức$Chính kịch$Một Ngày Nào Đó Chúng Ta Sẽ Kể Cho Nhau Mọi Điều - Someday We'll Tell Each Other Everything (2023) Full VietSub HD Bộ phim dựa trên tiểu thuyết cùng tên của Daniela Krien và có sự tham gia của các diễn viên Marlene Burow và Felix Kramer. Nội dung: Phim lấy bối cảnh mùa hè năm 1990 tại Đông Đức cũ, kể về một cô gái trẻ bắt đầu mối quan hệ với một nông dân lớn tuổi hơn cô gấp đôi. Bộ phim đã được công chiếu lần đầu tại Liên hoan phim Berlin vào ngày 17 tháng 2 năm 2023 và ra rạp vào ngày 14 tháng 4 năm 2023.$https://motchillti.net/phim/mot-ngay-nao-do-chung-ta-se-ke-cho-nhau-moi-dieu.html
Con Trai Bạn Mẹ (Chuyện Tình Nhà Bên)$Tập 12 VietSub$Yoo Je Won$70 phút/ tập$16 Tập$VietSub$2024$Hàn Quốc$Tình Cảm, Chính kịch, Tâm Lý, Gia Đình$Con Trai Bạn Mẹ (Chuyện Tình Nhà Bên) - Love Next Door (2024) Full VietSub HD Con Trai Bạn Mẹ (Chuyện Tình Nhà Bên) bộ phim Choi Seung Hyo (Jung Hae In) là một kiến ​​trúc sư trẻ đang thu hút được sự chú ý, đảm nhận vai trò CEO của Atelier In Architecture. Anh được mọi người yêu mến vì anh không chỉ có kỹ năng hoàn hảo mà còn sở hữu ngoại hình và tính cách tuyệt vời.Tuy nhiên, Choi Seung Hyo đã trải qua những khoảnh khắc đen tối trong quá khứ mà anh muốn xóa khỏi cuộc sống của mình. Những khoảnh khắc đó thường liên quan đến Bae Seok Ryu (Jung So Min). Khi họ 4 tuổi, mẹ của hai người đã trở thành bạn bè thân thiết. Nhờ có mẹ, Choi Seung Hyo và Bae Seok Ryu đã dành nhiều thời gian bên nhau như tắm cùng nhau tại nhà tắm dành cho phụ nữ.Trong khi đó, cuộc sống của Bae Seok Ryu rất suôn sẻ, lúc đi học thì luôn đứng hạng nhất ở trường, khi đi làm thì lúc nào cũng đam mê và tràn đầy năng lượng với những gì mình làm. Dù sự nghiệp đang phát triển trong vai trò là giám đốc sản phẩm của một tập đoàn toàn cầu có tên là God's Workplace, cô đột nhiên suy sụp và trở về Hàn Quốc với mong muốn bắt đầu lại cuộc sống của mình. Từ đây, Choi Seung Hyo và Bae Seok Ryu gặp lại nhau khi đã trưởng thành với nhiều tình huống trớ trêu bắt đầu xảy ra.$https://motchillti.net/phim/con-trai-ban-me-chuyen-tinh-nha-ben.html
Cuộc Hôn Nhân Ngọt Ngào Với Thiếu Chủ Cực Cưng Chiều$Full 06/06 VietSub$Kuwajima Kenji$24 Phút/Tập$6 Tập$VietSub$2024$Nhật Bản$Tình Cảm, Hài Hước, Tâm Lý$Cuộc Hôn Nhân Ngọt Ngào Với Thiếu Chủ Cực Cưng Chiều - Kahogona Waka Danna-sama no Amayakashi Kon/ Spoiled Marriage of an Overprotective Young Husband (2024) Full VietSub HD Câu chuyện tình yêu ngọt ngào này xoay quanh Tsuruoka Io và Someya Yukito, người mà Io đã ngưỡng mộ từ khi còn nhỏ. Vào ngày bố cô qua đời, Yukito đã tặng Io những viên kẹo konpeito ngọt ngào, từ đó anh trở thành thần tượng trong lòng cô. Khi lớn lên, Yukito trở thành thiếu chủ thừa kế lữ quán Someya, trong khi Io làm việc tại nơi đây với vai trò là một đầu bếp tập sự. Io đã luôn giữ tình cảm ngưỡng mộ Yukito từ xa cho đến khi một sự cố bất ngờ xảy ra, buộc cô phải kết hôn với anh. Những lời nói ngọt ngào và cử chỉ ân cần, trìu mến của Yukito khiến trái tim Io không thể ngừng rung động khi anh ở bên cô. Cuộc hôn nhân ngọt ngào và tràn đầy sự yêu thương, chiều chuộng của thiếu chủ Yukito dành cho Io vừa mới bắt đầu, hứa hẹn sẽ là một hành trình lãng mạn và đầy cảm xúc.$https://motchillti.net/phim/cuoc-hon-nhan-ngot-ngao-voi-thieu-chu-cuc-cung-chieu.html
Đối Tác Hôn Nhân: Nếu Yêu thì sẽ Ly Hôn$Tập 6 VietSub$Tanazawa Takayoshi$24 Phút/Tập$9 Tập$VietSub$2024$Nhật Bản$Tình Cảm, Hài Hước, Chính kịch, Tâm Lý$Đối Tác Hôn Nhân: Nếu Yêu thì sẽ Ly Hôn - Business Kon: Suki ni Nattara (2024) Full VietSub HD Câu chuyện xoay quanh Sayama Miyabi, một chuyên viên tư vấn bất động sản, người vừa bị bạn trai chia tay vào đúng ngày kỷ niệm 6 năm bên nhau. Sau cú sốc đó, Miyabi quyết định tập trung toàn bộ sức lực vào công việc và từ bỏ việc theo đuổi tình yêu. Trong một sự tình cờ, cô gặp Donose Tsukasa, một giám đốc trẻ tuổi có ý định kết hôn nhưng không muốn dựa trên tình cảm. Khi Tsukasa chứng kiến sự chuyên nghiệp của Miyabi trong công việc, anh đã đề nghị cô trở thành đối tác trong cuộc hôn nhân không tình yêu của mình. Mặc dù quyết định kết hôn một cách nhanh chóng, Tsukasa lại đưa ra một điều kiện thú vị: Nếu giữa hai người nảy sinh tình cảm, họ sẽ phải ly hôn. Tuy nhiên, những ngày tháng sống cùng nhau lại đầy ắp niềm vui và sự phấn khích, khiến cả hai dần có tình cảm với nhau. Dù vậy, họ vẫn phải giấu nhẹm mọi cảm xúc, không được để cho ai biết sự thật về mối quan hệ này. Câu chuyện đầy kịch tính và hài hước sẽ khiến người xem tự hỏi liệu cuộc hôn nhân không tình yêu này sẽ đi đến đâu, và liệu họ có thể vượt qua điều kiện mà chính mình đặt ra hay không?$https://motchillti.net/phim/doi-tac-hon-nhan-neu-yeu-thi-se-ly-hon-56969.html
Trăng Khuất$Tập 3 VietSub$Đang cập nhật$60 phút/tập$10 Tập$VietSub$2024$Thái Lan$Tình Cảm, Hài Hước, Chính kịch, Tâm Lý$"Trăng Khuất - The Hidden Moon (2024) Full VietSub HD ""Một dinh thự cổ hai tầng hùng vĩ đứng sừng sững dưới chân đồi, được bao quanh bởi thiên nhiên. Không khí tỏa ra từ nơi đây vừa lôi cuốn vừa bí ẩn. Dinh thự đang háo hức chờ đợi sự xuất hiện của một nhóm người từ nơi xa. Trong số đó có một nhà viết quảng cáo trẻ tuổi đầy năng động, người sẽ làm việc cho chiến dịch tiếp thị của khu nghỉ dưỡng này, nơi tập trung vào việc bảo tồn thiên nhiên."""$https://motchillti.net/phim/trang-khuat-4877848.html
Minh Tri Cố Ái$Tập 16 Vietsub$Đang cập nhật$14 phút/tập$20 Tập$Vietsub$2024$Trung Quốc$Tình Cảm$Minh Tri Cố Ái - First Choice (2024) Full VietSub HD$https://motchillti.net/phim/minh-tri-co-ai-878969.html
Đảo Hải Tặc$Tập 1120 Vietsub$Đang cập nhật$25 phút/ tập$? tập$Vietsub$1999$Nhật Bản$Hành Động, Hài Hước, Phiêu Lưu, Hoạt Hình$Đảo Hải Tặc - One Piece (Luffy) (1999) Full VietSub HD$https://motchillti.net/phim/dao-hai-tac.html
Thành Thời Gian$Full 38/38 VietSub$Chan Ka Lam$45 phút/tập$38 Tập$VietSub$2023$Trung Quốc$Chính kịch, Tình Cảm, Tâm Lý$Thành Thời Gian - Castle in the Time (2023) Full VietSub HD Thành Thời Gian (Castle in the Time) Một cuộc gặp gỡ đưa một sinh viên cổ sinh vật học đến với một diễn viên đã thành danh và chuyện tình lãng mạn xảy ra sau đó. Xu Zhen, cô gái trẻ thông minh và lạc quan, không bao giờ từ bỏ trước khó khăn. Với mong muốn hàn gắn gia đình, cô quyết định xin việc tại Jiang Ye Entertainment, nơi mà mẹ cô đang làm Giám đốc, và tại đó, cô chứng kiến Gu Chi Jun bị từ chối bởi bạn gái cũ một lần nữa. Gu Chi Jun, với cái tôi lớn và nhiều tổn thương, cố gắng che giấu quá khứ của mình và cố gắng đẩy Xu Zhen ra xa khỏi cuộc sống của anh. Tuy nhiên, thay vì làm điều đó, cô đã vượt qua mọi khó khăn và trở thành trợ lý đặc biệt của anh. Trong quá trình làm việc, cô phát hiện ra một âm mưu nguy hiểm bên trong công ty, và bản thân cô có thể đối diện với nguy cơ lớn khi bí mật này bị vạch trần.$https://motchillti.net/phim/thanh-thoi-gian-7955548.html
Quân Diện Tự Đào Hoa$Tập 10 Vietsub$Đang cập nhật$13 phút/tập$26 Tập$Vietsub$2024$Trung Quốc$Chính kịch, Tình Cảm, Tâm Lý, Cổ Trang$Quân Diện Tự Đào Hoa - Pavilion Secrets (2024) Full VietSub HD$https://motchillti.net/phim/quan-dien-tu-dao-hoa-6493255.html
Dối Trá$Tập 13 VietSub$Hakan İnan$120 phút/tập$?$VietSub$2024$Thổ Nhĩ Kỳ$Gia Đình, Chính kịch$Dối Trá - Lie (2024) Full VietSub HD$https://motchillti.net/phim/doi-tra-856996.html
Pin Pak: Trâm Cài Tóc Hoàng Gia$Tập 8 Vietsub$Đang cập nhật$60 phút/ tập$16 Tập$Vietsub$2024$Thái Lan$Tình Cảm$Pin Pak: Trâm Cài Tóc Hoàng Gia - The Loyal Pin (2024) Full VietSub HD$https://motchillti.net/phim/pin-pak-tram-cai-toc-hoang-gia-69633.html
Thị Trấn Ác Mộng Phần 3$Tập 1 Vietsub$Đang cập nhật$60 phút/tập$10 Tập$Vietsub$2024$Âu Mỹ$Viễn Tưởng, Khoa Học, Bí ẩn$Thị Trấn Ác Mộng Phần 3 - From Season 3 (2024) Full VietSub HD Làm sáng tỏ bí ẩn về một thành phố ở Trung Mỹ giam giữ tất cả những ai bước vào. Khi các cư dân đấu tranh để trở lại bình thường và tìm kiếm một lối thoát, họ cũng phải sống sót trước các mối đe dọa của khu rừng xung quanh.$https://motchillti.net/phim/thi-tran-ac-mong-phan-3-549696.html
Mỏng Manh Dễ Vỡ$tập 3 Vietsub$Kim Ji Hoon$30 phút/tập$8 tập$Vietsub$2024$Hàn Quốc$Tình Cảm, Gia Đình, Học Đường$"Mỏng Manh Dễ Vỡ - Fragile (2024) Full VietSub HD Không chút do dự, nắm bắt được những mối quan tâm thực tế và cuộc sống hàng ngày của những thiếu niên ""mong manh"". Cho thấy những điều cấm kỵ mà thanh thiếu niên phải đối mặt trong những năm cuối của tuổi thiếu niên trước khi trở thành người lớn, chẳng hạn như tình yêu nguy hiểm với một người bạn khác giới và những hành vi lệch lạc nguy hiểm mà họ thích trong khi tránh né ánh mắt của người lớn."$https://motchillti.net/phim/mong-manh-de-vo.html
Thanh Xuân Đón Gió$Full 30/30 VietSub$Xing Jian Jun$45 phút/ tập$30 Tập$VietSub$2024$Trung Quốc$Tình Cảm, Chính kịch, Tâm Lý, Gia Đình$"Thanh Xuân Đón Gió - Wind Direction (2024) Full VietSub HD Câu chuyện kể về hai chị em Trình Miêu Miêu 17 tuổi và Trình Nha Nha 16 tuổi, sinh ra trong một gia đình ba thế hệ đều làm việc tại nhà máy khai thác dầu mỏ Lâm Thất. Bố của họ, Trình Bằng Phi, là bác sĩ tai mũi họng, còn mẹ, Giả Đại Ngọc, làm công việc hậu cần cho đội xe. Gia đình đã chuyển từ Tây Bắc đến thị trấn ven biển Hà Bình, và cuộc sống của họ thay đổi đáng kể. Vào cuối thập niên 90, Miêu Miêu, với lòng khao khát khám phá thế giới bên ngoài, đã cùng người bạn thanh mai trúc mã Lý Tứ và cô bạn thân Hồ Thu Mẫn lên kế hoạch cho chuyến phiêu lưu trong kỳ nghỉ hè lớp 10 để ""đón ngày Hong Kong trở về."" Tuy nhiên, chuyến đi không diễn ra suôn sẻ. Trong khi đó, Nha Nha, cậu em trai 16 tuổi, tham gia vào một cuộc khảo cổ trên núi và suýt bị hiểu lầm là kẻ đào mộ, khiến mẹ Giả Đại Ngọc vô cùng lo lắng. Cả hai chị em bắt đầu cuộc sống cấp ba đầy rắc rối. Miêu Miêu đối mặt với khủng hoảng tình cảm với Lý Tứ, trong khi Nha Nha đứng ra bảo vệ cô bạn mới chuyển đến, Viên Sơn Thanh, con gái của một kẻ truy nã, khỏi sự kỳ thị và ánh mắt thù địch từ bạn bè. Trong bối cảnh thay đổi liên tục, các cô cậu học sinh trải qua những thách thức và dần trưởng thành qua những sự kiện và mâu thuẫn xung quanh cuộc sống của họ. Câu chuyện không chỉ là hành trình khám phá bản thân của những người trẻ mà còn là hành trình trưởng thành, khi họ phải đối mặt với những thử thách về tình bạn, tình yêu và gia đình trong bối cảnh biến động của xã hội cuối thập niên 90."$https://motchillti.net/phim/thanh-xuan-don-gio-569333.html
Love Sick 2024$Tập 2 VietSub$Cheewin Thanamin Wongskulphat$60 phút/tập$15 Tập$VietSub$2024$Thái Lan$Tình Cảm, Hài Hước, Chính kịch, Tâm Lý$"Love Sick 2024 - Love Sick the Series (2024) Full VietSub HD Câu chuyện diễn ra tại một trường nam sinh có tên là ""Friday College."" Phun, phó chủ tịch hội học sinh hoàn hảo, đã có bạn gái nhưng cha của cậu lại muốn cậu hẹn hò với con gái của bạn mình. Cha của Phun không chịu lắng nghe cậu, nhưng lại rất chiều chuộng em gái nhỏ Pang, người bị ám ảnh với những câu chuyện tình yêu giữa các chàng trai. Trong khi đó, Noh, chủ tịch năng động của câu lạc bộ âm nhạc, đang cần thêm ngân sách cho câu lạc bộ, nếu không cậu sẽ gặp phải rắc rối lớn. Biết rằng mình có thể giúp Noh giải quyết vấn đề này, Phun quyết định yêu cầu Noh làm bạn trai giả của mình để đổi lấy sự giúp đỡ. Tuy nhiên, mối quan hệ giả vờ này nhanh chóng biến thành điều gì đó sâu sắc hơn khi Noh và Phun bắt đầu nảy sinh tình cảm với nhau."$https://motchillti.net/phim/love-sick-2024.html
Vô Thượng Thần Đế$Tập 416 VietSub$Đang cập nhật$30 phút/tập$464 Tập$VietSub$2020$Trung Quốc$Hoạt Hình$"Vô Thượng Thần Đế - Wu Shang Shen Di, Supreme God Emperor (2020) Full VietSub HD Vô Thượng Thần Đế Mười ngàn năm trước, vị vua bất tử Muyun bị người khác âm mưu chiếm giữ Zhu Xiantu. Sau 10.000 năm ngủ yên, linh hồn còn sót lại của anh đã thức tỉnh trên ""Trash Muyun"" nổi tiếng của Nam Vân Đế Quốc trên lục địa Thiên Mệnh."$https://motchillti.net/phim/vo-thuong-than-de-112586.html
VTuber Nandaga Haishin Kiri Wasuretara Densetsu ni Natteta$Full 12/12 VietSub$Đang cập nhật$30 phút/ tập$12 Tập$VietSub$2024$Nhật Bản$Hoạt Hình$"VTuber Nandaga Haishin Kiri Wasuretara Densetsu ni Natteta - VTuber Legend: How I Went Viral after Forgetting to Turn Off My Stream (2024) Full VietSub HD VTuber Nandaga Haishin Kiri Wasuretara Densetsu ni Natteta Tanaka Yuki, nghệ danh là Kokorone Awayuki, bằng một phép thần kỳ nào đó mà được một chân vào thế hệ thứ ba của các Youtuber ảo quản lý bởi công ty ""Live on"". Vĩnh biệt công việc hiện tại của cổ tại một công ty đen, cô trở thành một Youtuber ảo - thứ đã làm động lực cho cô sống sót trong chuỗi ngày địa ngục. Tuy nhiên, hình như cổ thiếu một cú huých, và cho đến hiện tại, cổ thua xa các tiền bối và hậu bối về độ nổi tiếng. Bỗng một ngày, cô quên tắt stream đi và bản tính thật của cô nàng được bày ra cho cả thế giới chiêm ngưỡng."$https://motchillti.net/phim/vtuber-nandaga-haishin-kiri-wasuretara-densetsu-ni-natteta.html
Linh Vũ Đại Lục$Tập 21 VietSub$Đang cập nhật$30 phút/tập$60 Tập$VietSub$2024$Trung Quốc$Hoạt Hình$Linh Vũ Đại Lục - Ling Wu Dalu (2024) Full VietSub HD Linh Vũ Đại Lục là thế giới mà sức mạnh tinh thần và võ hồn cùng tồn tại. Một tu sĩ tinh thần có thể di chuyển núi sông bằng một ý nghĩ, và một võ sĩ có thể xé nát thế giới bằng tay không. Chen Tian, ​​​​một thiên tài trước đây ở thị trấn Xingchen, đã mất đi tinh thần võ hồn và cạn kiệt biển tinh thần của mình sau khi anh tròn mười tuổi. Kể từ đó, anh trở thành một kẻ lãng phí của gia đình và bị những người khác coi thường. Trong một cuộc đấu tranh sinh tử, Chen Tian đã rơi xuống vực và nhầm lẫn bước vào trận đồ do hoàng đế kiếm cổ sắp xếp. Dưới ảnh hưởng của sức mạnh của thiên thư, anh đã thức tỉnh thể chất tu luyện song tu tinh thần và võ hồn của mình. Đồng thời, anh cũng có được một ký ức kỳ lạ và một chiếc nhẫn lưu trữ bí ẩn. Từ đó trở đi, anh đã vươn lên từ nghịch cảnh, đột phá sự tái sinh của Thiên Đạo Chưởng, và cuối cùng đã vượt qua xiềng xích của tai ương hoàng đế và khao khát trở thành nhà vô địch của Linh Vũ Đại Lục.$https://motchillti.net/phim/linh-vu-dai-luc.html
Kami no Tou: Ouji no Kikan$Tập 12 Sắp Chiếu$Đang cập nhật$45 phút/tập$13$Sắp Chiếu$2024$Nhật Bản$Hoạt Hình$Kami no Tou: Ouji no Kikan - Tower of God Season 2 (2024) Full VietSub HD$https://motchillti.net/phim/kami-no-tou-ouji-no-kikan-744848.html
The Fable$Tập 24 VietSub$Đang cập nhật$30 phút/tập$25 Tập$VietSub$2024$Nhật Bản$Hoạt Hình$The Fable - ザ・ファブル (2024) Full VietSub HD The Fable là một tay sát thủ lão luyện giỏi nhất trong lĩnh vực của mình. Tuy nhiên, anh ta đã giết rất nhiều người đến nỗi ông chủ của anh ta yêu cầu anh ta phải nằm im trong một thời gian. Trong khoảng thời gian này, Fable không nên giết bất cứ ai nếu không muốn bị trừng phạt chết người.Tuy nhiên, sống một cuộc sống bình thường có thể là điều khó khăn nhất mà kẻ sát nhân từng làm.$https://motchillti.net/phim/the-fable-17204323588412.html
Tán Tu Chi Vương$Tập 29 VietSub$Đang cập nhật$30 phút/tập$52 Tập$VietSub$2024$Trung Quốc$Hoạt Hình$Tán Tu Chi Vương - San Xiu Zhi Wang (2024) Full VietSub HD Tán Tu Chi Vương Một thiếu niên bình thường bỗng nhiên quen biết khí linh thượng cổ. Nhờ sự giúp đỡ của khí linh, hắn gắng sức tu luyện, kết giao với đủ mọi loại người, trải qua bao nhiêu thăng trầm hiểm nguy, cuối cùng hắn trở thành người siêu phàm, bảo vệ toàn đại lục.$https://motchillti.net/phim/tan-tu-chi-vuong-25699.html
Monogatari Series: Off & Monster Season$Tập 10 VietSub$Đang cập nhật$30 phút/tập$$VietSub$2024$Nhật Bản$Hoạt Hình$Monogatari Series: Off & Monster Season - Orokamonogatari, Wazamonogatari, Nademonogatari, Musubimonogatari, Shinobumonogatari, Yoimonogatari, Amarimonogatari, Ougimonogatari, Shinomonogatari (2024) Full VietSub HD Monogatari Series: Off & Monster Season Sau khi tốt nghiệp trung học, câu chuyện về Koyomi Araragi đã kết thúc. Lần này, nó thực sự kết thúc. Tuy nhiên, câu chuyện về những cô gái được Araragi cứu vẫn chưa kết thúc. Đây là phần tiền truyện, hoặc có lẽ là phần tiếp theo của những cuộc đấu tranh của họ trong tuổi trẻ.$https://motchillti.net/phim/monogatari-series-off-monster-season.html
