Giải Cứu Địa Cầu$Full 24/24 VietSub$Đang cập nhật$30 phút/tập$24 Tập$VietSub$2023$Nhật Bản$Hoạt Hình$Giải Cứu Địa Cầu - NieR:Automata Ver1.1a (2023) Full VietSub HD  Giải Cứu Địa Cầu Tương lai xa, 5012. Cuộc xâm lược Trái đất bất ngờ trên không của < Người ngoài hành tinh ＞ và những sáng tạo của họ ＜ Dạng sống Máy móc＞ đã đẩy nhân loại đến bờ vực tuyệt chủng. Số người còn sống sót đã trú ẩn trên mặt trăng để tổ chức một cuộc phản công bằng cách sử dụng binh lính ＜android＞ để chiếm lại Trái đất. Tuy nhiên, cuộc chiến đi vào bế tắc khi ＜Machine Lifeforms＞ tiếp tục nhân lên vô tận. Đổi lại, nhân loại triển khai một đơn vị lính android mới như một vũ khí tối thượng: ＜YoRHa＞ Mới được cử đến Trái đất ＜2B＞ tham gia＜9S＞, nhà phân tích hiện đang đóng quân ở đó, nơi mà trong quá trình thực hiện nhiệm vụ, họ gặp phải vô số hiện tượng bí ẩn... Đây là câu chuyện về những ＜android＞ vô hồn này và cuộc chiến bất tận của họ vì lợi ích của nhân loại.$https://motchillti.net/phim/giai-cuu-dia-cau-46969.html
Lưu Thủy Điều Điều$Tập 29 VietSub$Đang cập nhật$40 phút/ tập$43 Tập$VietSub$2024$Trung Quốc$Tình Cảm, Chính kịch, Tâm Lý, Cổ Trang$Lưu Thủy Điều Điều - Love of Nirvana (2024) Full VietSub HD Tiêu Vô Hà, thiếu thành chủ của thành Nguyệt Lạc, nhẫn nhục chịu đựng nằm vùng ở nước Lương nhiều năm với cái tên Vệ Chiêu, gánh vác tội danh gian thần. Vì muốn điều tra chân tướng về gia tộc năm xưa, Vệ Chiêu có ý định bắt cóc người còn sống sót duy nhất trong vụ án Tề Vương, song kế hoạch y dày công sắp đặt lại bị phá hỏng bởi cô gái trẻ bất ngờ xuất hiện, Giang Từ. Bùi Diễm nhân cơ hội này đưa Giang Từ đang bị thương nặng về phủ để tìm ra kẻ đã phá hỏng kế hoạch phía sau. Cảnh ngộ bi thương và đại nghĩa vì dân tộc của Vệ Chiêu đã lay động trái tim trong sáng của Giang Từ. Qua thời gian tiếp xúc, cả hai đã nhận ra điểm tốt đẹp ở đối phương, dần nảy sinh tình cảm. Cuối cùng, ba người Vệ Chiêu, Giang Từ và Bùi Diễm buông bỏ ân oán cá nhân, cùng nhau chống lại Lương Đế, thực hiện tâm nguyện bảo vệ Nguyệt Lạc, xây dựng một thiên hạ sạch trong.$https://motchillti.net/phim/luu-thuy-dieu-dieu-89969.html
Tuyệt Thế Chiến Hồn 3D$Tập 48 VietSub$Đang cập nhật$30 phút/tập$$VietSub$2024$Trung Quốc$Hoạt Hình$Tuyệt Thế Chiến Hồn 3D - Peerless Soul 3D (2024) Full VietSub HD Đại lục Thương Lam là nơi nếu muốn thành võ giả thì bắt buộc phải thức tỉnh được võ hồn, từ đó kết nối với trời đất, hấp thụ linh khí, tiến hành tu luyện. Thiếu niên bình thường Tần Nam thức tỉnh được Chiến Thần Chi Hồn để không ngừng trở nên mạnh, để báo đáp ơn tri ngộ của Tiêu Khinh Tuyết, đã trải qua bao trắc trở, bị cuốn vào những cuộc tranh đấu khốc liệt, cuối cùng danh chấn Thương Lam, đứng trên vạn người.$https://motchillti.net/phim/tuyet-the-chien-hon-3d-755869.html
Huyễn Nhạc Sâm Lâm$Tập 18 Vietsub$Hà Hoằng Huy$45 phút/tập$24 tập$Vietsub$2024$Trung Quốc$Cổ Trang$Huyễn Nhạc Sâm Lâm - Echo of Her Voice (2024) Full VietSub HD$https://motchillti.net/phim/huyen-nhac-sam-lam.html
Pokemon (2023)$Tập 67 VietSub$Đang cập nhật$30 phút/tập$$VietSub$2023$Nhật Bản$Hoạt Hình$Pokemon (2023) - Pokémon Horizons: The Series, Pokemon: Liko to Roy no Tabidachi, Pocket Monsters: Liko to Roy no Tabidachi, Pokemon Horizons: Liko and Roy's Departure (2023) Full VietSub HD Theo dõi Liko và Roy khi họ làm sáng tỏ những bí ẩn xung quanh họ và chạm trán với Friede, Thuyền trưởng Pikachu, Amethio và những người khác trong cuộc phiêu lưu thú vị của họ!$https://motchillti.net/phim/pokemon-2023.html
21 Ngày$Tập 7 Vietsub$David Chuang$42 Phút/Tập$12 Tập$Vietsub$2024$Trung Quốc$Kinh Dị, Bí ẩn, Hình Sự, Tâm Lý, Phiêu Lưu, Hành Động$21 Ngày - The Limbo (2024) Full VietSub HD Gần đến Tết, một sự cố nghiêm trọng xảy ra tại trung tâm thương mại lâu đời La Bách Bách Hóa ở thành phố Hải Châu, khi mặt đất đột ngột bị lún sụt, khiến 13 người bị mắc kẹt dưới lòng đất. Cuộc đua với thời gian để cứu sống những người bị mắc kẹt trở thành một thử thách lớn không chỉ về mặt kỹ thuật mà còn về nhân tính, đạo đức và niềm tin của những người tham gia. Những lựa chọn khó khăn và sự đấu tranh giữa lòng dũng cảm và sợ hãi đã vẽ nên bức tranh căng thẳng, đầy cảm xúc trong cuộc giải cứu sinh tử này.$https://motchillti.net/phim/21-ngay.html
Thần Mộ$Tập 25 Vietsub$Hui Tong$74 phút$$Vietsub$2022$Trung Quốc$Hoạt Hình$Thần Mộ - Divine Grave, Shen Mu (2022) Full VietSub HD kể về chàng thiếu niên tên Thần Nam được hồi sinh sau 1 vạn năm tại Thần Ma Lăng Viên. Thần Ma Lăng Viên nằm ở chính giữa Thiên Nguyên đại lục. Đây là nơi an táng những nhân vật mạnh nhất trong lịch sử xuyên suốt vũ trụ từ thời hồng hoang. Nơi này bền vững cùng thiên địa cao xanh. Khu mộ phần được phân loại theo cấp độ mạnh yếu, càng tiến vào sâu bên trong thì càng có nhiều mộ của những nhân vật cực mạnh. Mỗi ngôi mộ, nếu không phải của thần linh thì cũng là của yêu ma thượng cổ. Đây chính là nơi thần thánh và ma quỷ yên nghỉ ngàn thu. Sau khi tỉnh lại, nam chính Thần Nam sẽ trải qua hành trình tìm lại bản thân, biết được nguyên nhân vì sao mình lại xuất hiện tại Thần Ma Lăng Viên và làm thế nào để tìm được Vũ Hinh – người con gái mình yêu.$https://motchillti.net/phim/than-mo-172554239259399.html
Man Hoang Tiên Giới$Tập 5 Vietsub$Đang cập nhật$45 phút/tập$48 Tập$Vietsub$2024$Trung Quốc$Hoạt Hình$Man Hoang Tiên Giới - Man Huang Xian Jie (2024) Full VietSub HD Ở Man Hoang Tiên Giới bao la vô tận, văn hoá tu tiên vô cùng thịnh hành. Người phàm ai cũng muốn khát khao trở thành tu sĩ. Lục Hàng Chi, một sinh viên đại học, đã xuyên không từ thời hiện đại đến làm một người phàm ở trấn Tử Vân, ngày nào cũng phải sống trong lo sợ. Tuy nhiên, hắn không cam chịu sống một cuộc sống như vậy, luôn cố gắng tiến về phía để thoát khỏi hoàn cảnh hiện tại. Sau đó, nhờ một hành động thiện mà hắn được đại tiểu thư của Chu phủ và sư huynh của cô ấy để ý tới. Họ đưa hắn tới Chu phủ để trải qua thử thách. Sau cố gắng không ngừng và may mắn có được một vài cơ duyên, hắn đã trở thành đệ tử ngoại môn của Huyền Tâm Tông và bắt đầu hành trình tu tiên của mình.$https://motchillti.net/phim/man-hoang-tien-gioi.html
Nhất Thế Độc Tôn$Tập 58 Vietsub$Đang cập nhật$42 phút/tập$$Vietsub$2023$Trung Quốc$Hoạt Hình$"Nhất Thế Độc Tôn - Yi Shi Du Zun (2023) Full VietSub HD Sau khi kiếm nô Lâm Vân của Thanh Vân Tông trùng sinh, ngộ tính vốn rất kém nay lại trở nên khác người, sau một bộ Mãnh Hổ Quyền lại có thể đột phá đến võ đạo Tam Trùng cảnh có thể trở thành đệ tử ngoại môn của tông môn. Nhưng dù thoát khỏi thân phận kiếm nô trở thành đệ tử ngoại môn, Lâm Vân vẫn bị các đệ tử khác kỳ thị, tất cả đều chỉ vì ""một ngày làm kiếm nô, cả đời làm kiếm nô""."$https://motchillti.net/phim/nhat-the-doc-ton.html
Luyện Khí Mười Vạn Năm$Tập 170 VietSub$Đang cập nhật$30 phút/tập$160$VietSub$2023$Trung Quốc$Hoạt Hình$Luyện Khí Mười Vạn Năm - Lian Qi Shi Wan Nian (2023) Full VietSub HD Mười vạn năm trước Thiên Lam Tông vang dội giới tu chân, đệ tử trong tông đều là những đứa con của trời, đánh đâu thắng đó. Chỉ có khai sơn đệ tử Từ Dương vẫn luôn ở Luyện Khí kỳ, để đột phá tu vi sớm ngày phi thăng, Từ Dương bế quan vạn năm. Ai ngờ trong thời gian bế quan giới tu chân đã xuống dốc, Thiên Lam Tông cũng chỉ còn vài ba đệ tử, thấy sắp phải đối mặt với diệt tông, Từ Dương đánh bại cường địch, thề sẽ dẫn dắt Thiên Lam Tông quay về đỉnh cao!$https://motchillti.net/phim/luyen-khi-muoi-van-nam-744848.html
Chân Võ Đỉnh Phong 2$Tập 141 VietSub$Đang cập nhật$30 phút/tập$156 Tập$VietSub$2023$Trung Quốc$Hoạt Hình$Chân Võ Đỉnh Phong 2 - The Peak of True Martial Arts 2nd Season (2023) Full VietSub HD$https://motchillti.net/phim/chan-vo-dinh-phong-2-96999.html
Thiên Kim Giá Đáo 1998$Tập 8 Vietsub$Yi Lin$16 phút/tập$24 Tập$Vietsub$2024$Trung Quốc$Viễn Tưởng, Khoa Học, Chính kịch, Tình Cảm, Tâm Lý$Thiên Kim Giá Đáo 1998 - Qian Jin Jia Dao 1998 (2024) Full VietSub HD$https://motchillti.net/phim/thien-kim-gia-dao-1998-69595.html
Đại Hải Đạo$Tập 13 VietSub$Đang cập nhật$45 phút/tập$24 Tập$VietSub$2024$Trung Quốc$Tình Cảm, Chính kịch, Tâm Lý, Phiêu Lưu$Đại Hải Đạo - Brother (2024) Full VietSub HD Câu chuyện xoay quanh một giải đua xe địa hình hàng đầu thế giới, mang đến cái nhìn sâu sắc về những người trẻ đầy nhiệt huyết, không ngừng theo đuổi ước mơ của mình. Nhóm thanh niên sống tại Tân Cương, đến từ nhiều dân tộc khác nhau, đã dùng niềm đam mê và sự kiên định để tái khởi động con đường tơ lụa cổ xưa, biến mình thành những anh hùng trong cuộc sống đời thường. Họ mang theo bản năng hoang dã từ vùng Đại Hải Đạo, kể lại một câu chuyện Tân Cương của thời đại mới, nơi chứa đựng đầy tình người và cảm xúc sâu sắc. Thông qua hành trình này, họ không chỉ truyền tải tình yêu quê hương, mà còn giới thiệu đến thế giới một bức tranh sống động và đa chiều về cuộc sống đương đại tại Tân Cương, thể hiện tinh thần đoàn kết và sức mạnh của thế hệ trẻ trong việc xây dựng tương lai tươi sáng.$https://motchillti.net/phim/dai-hai-dao.html
Đêm Tối Và Bình Minh$Tập 23 Vietsub$Li Cai, Nan Huang$45 phút/tập$40 Tập$Vietsub$2024$Trung Quốc$Chính kịch, Bí ẩn, Tâm Lý$"Đêm Tối Và Bình Minh - Dark Night and Dawn (2024) Full VietSub HD Vào năm 1943 tại Thượng Hải, một vụ nổ đã dẫn đến cuộc đối đầu giữa đặc vụ ngầm của Đảng Cộng sản Lu Zhengyang và cựu cảnh sát Lin Shaobai. Sáu năm sau, Lu Zhengyang, giờ đã trở thành một thành viên chủ chốt của Cục An ninh Công cộng Thượng Hải, chiêu mộ Lin Shaobai, người được mệnh danh là ""Chuyên gia Thượng Hải,"" để giải quyết các vụ án lớn và ngăn chặn âm mưu của điệp viên kỳ cựu Zheng Lanting. Khi cùng hợp tác, Lu Zhengyang và Lin Shaobai dần xây dựng lòng tin và trở thành những đồng chí thân thiết."$https://motchillti.net/phim/dem-toi-va-binh-minh-48699.html
Nhục Cảm$Full Vietsub$Pedro Almodóvar$1h 40m$Full$Vietsub$1997$Tây Ban Nha$Tình Cảm$Nhục Cảm - Live Flesh (1997) Full VietSub HD Một cô gái không thể đến được bệnh viện đã phải đẻ rơi trên xe buýt. Để bù đắp, thành phố cấp cho mẹ con cô thẻ miễn phí xe buýt suốt đời. 20 năm sau trong 1 đêm tối Víctor Plaza (cậu bé bị đẻ rơi trên xe buýt) bị cô nàng Elena xinh đẹp giàu có chịu chơi lôi vào toilet bóc tem, quá phê cô nàng đã có những lời hứa hẹn. Víctor si tình, ngây thơ non trẻ cứ ngỡ là thật, tuần sau cậu lại mò đến như lời hẹn nào ngờ đó chỉ là phút cao hứng của người đàn bà, cho dù bị xua đuổi hù dọa thậm chí cả khi khẩu súng chĩa thẳng vào đầu anh quyết không bỏ cuộc. Rồi mọi chuyện không mong muốn xảy ra, súng nổ, có người bị thương và Víctor bị tống vào tù. Bốn năm sau Víctor ra tù, Anh vẫn yêu tha thiết Elena, nhưng cô ấy đã kết hôn với một cựu cảnh sát - bây giờ là vận động viên bóng rổ- người đã bị liệt do một viên đạn từ súng của Víctor... và một lần nữa 3 con người lại bắt đầu phải vượt qua số phận.$https://motchillti.net/phim/nhuc-cam.html
Bạn Nai Nokotan Của Tôi$Tập 10 VietSub$Đang cập nhật$30 phút/tập$$VietSub$2024$Nhật Bản$Hài Hước, Hoạt Hình$"Bạn Nai Nokotan Của Tôi - My Deer Friend Nokotan (2024) Full VietSub HD Bạn Nai Nokotan Của Tôi Hỡi con người, hãy ""nai"" lên! Toraishi Torako là nữ sinh tại trường cấp ba Hino Minami, Tokyo. Một ngày nọ, khi đang đến trường, cô bỗng thấy lạnh toát sống lưng. Ngẩng đầu lên, cô thấy một cô gái với nước mũi chảy thòng lòng đang bị kẹt sừng trên dây điện!? Cuộc sống của cô học sinh gương mẫu (bề ngoài), đã bị đảo lộn. Và thế là câu chuyện gái (một cựu nữ quái) gặp nai (?) đã bắt dầu!"$https://motchillti.net/phim/ban-nai-nokotan-cua-toi-825699.html
Vô Chủ Chi Thành$Full 24/24 Vietsub$Zhao Tian Yu$42M1S$24 Tập$Vietsub$2019$Trung Quốc$Phiêu Lưu, Kinh Dị, Bí ẩn$"Vô Chủ Chi Thành - Last One Standing (2019) Full VietSub HD ""Vì điều tra vụ án mà cảnh sát La Nhiên khiến Đào Tử vợ mình chết ngoài ý muốn, bản thân cũng xin từ chức. Chịu đả kích quá lớn, anh ta lao vào điều tra và tìm được nghi phạm, đó là nữ tiến sĩ IT Giang Tuyết. La Nhiên theo dõi Giang Tuyết lên tàu hỏa, đi tới một tòa thành trống, mất liên lạc với bên ngoài. Trong thành nguy hiểm rình rập, đám người nhanh chóng phân hóa, bạn bè trở mặt, anh em hận thù, những người xa lạ thì không từ thủ đoạn, nhưng họ không biết rằng, mỗi một hành động tranh đấu và tìm cái sống của họ đều bị theo dõi….. """$https://motchillti.net/phim/vo-chu-chi-thanh.html
Vĩnh Dạ Trường Minh$Full 30/30 VietSub$Wu Cheng Feng$45 phút/tập$30 Tập$VietSub$2024$Trung Quốc$Tình Cảm, Tâm Lý, Phiêu Lưu, Cổ Trang, Võ Thuật$Vĩnh Dạ Trường Minh - Dawn is Breaking (2024) Full VietSub HD Vĩnh Dạ Trường Minh nội dung phim xoay quanh câu chuyện của tiểu thư Tạ gia Tạ Vãn Âm (Hà Tuyên Lâm) và quốc sư Đông Phương Túy (Lý Phi). Trong ngày thành hôn của Tạ Vãn Âm và Thái tử Lý Trì, vị quốc sư luôn có dáng vẻ thanh cao, không nhiễm bụi trần trong truyền thuyết lại thản nhiên sát hại quốc trượng đương triều.Là nhân chứng, Tạ Vãn Âm trở thành “con mồi” của quốc sư Đông Phương Túy. Dưới âm mưu của Đông Phương Túy, hôn lễ giữa Tạ Vãn Âm và Thái tử quả nhiên đã xảy ra biến cố. Tuy nhiên, Đông Phương Túy lại không diệt khẩu mà uy hiếp cả Tạ gia để ép buộc Tạ Vãn Âm trở thành phu nhân của mình.Người đời đều đồn rằng quốc sư một thân áo trắng, bộc trực và cởi mở nhưng trong mắt Tạ Vãn Âm, Đông Phương Túy là một người hoàn toàn khác: Điên cuồng và tàn bạo. Vốn là người thẳng thắn và dũng cảm, cô thà chết cũng không chịu nghe theo sự sắp xếp của Đông Phương Túy.Ngay trong đêm tân hôn, Tạ Vãn Âm quyết tâm lấy mạng quốc sư đương triều. Chẳng ngờ, vị quốc sư này lại không hề tức giận, mà còn cười tươi và nắm chặt lấy bàn tay đang cầm dao của Tạ Vãn Âm, thuận thế đâm vào ngực mình.“Phu nhân muốn giết ta thì nói với ta một câu là được, không cần vòng vo như vậy”, Đông Phương Túy nói với Tạ Vãn Âm.Kể từ đó, Tạ Vãn Âm bắt đầu hành trình đấu trí với phu quân quốc sư của mình nhưng dần dần, cô phát hiện ra Đông Phương Túy có vẻ khá giống với một người quen cũ khi nhỏ. Cùng lúc này, một âm mưu được nung nấu suốt vài năm liên quan tới người của hai triều đại cũng bắt đầu phía sau hai người, chân tướng dần lộ rõ.$https://motchillti.net/phim/vinh-da-truong-minh-69359.html
Tinh Hoa Muay$Full 01/01 Vietsub$Robert Grasmere$101 phút$1 tập$Vietsub$2024$Âu Mỹ$Hành Động$Tinh Hoa Muay - Art of Eight Limbs (2024) Full VietSub HD Bộ phim kể về một nhà phân tích dữ liệu trẻ tuổi của CIA, người có kỹ năng boxing và được giao một nhiệm vụ cực kỳ nhạy cảm. Khi một lãnh chúa ở Myanmar đang bán khí độc VX cho kẻ trả giá cao nhất, CIA can thiệp để ngăn chặn kế hoạch của hắn. Lựa chọn tốt nhất của họ không phải là một đặc vụ kỳ cựu, mà là một nhà phân tích dữ liệu. Trong khi bị cuốn vào thế giới tội phạm này, anh phải đối mặt với những chiến binh tài năng trong một giải đấu võ thuật chết người, không chỉ để bảo vệ tính mạng của mình mà còn là số phận của cả thế giới.$https://motchillti.net/phim/tinh-hoa-muay.html
Thấy 2$Full 08/08 Vietsub$Anders Engström$60 phút/tập$8$Vietsub$2021$Âu Mỹ$Chính kịch, Hành Động, Viễn Tưởng$Thấy 2 - See season 2 (2021) Full VietSub HD Trong một tương lai xa xôi, loài người đã mất đi thị giác và xã hội phải tìm ra những cách mới để tương tác, xây dựng, săn bắn và sinh tồn. Tất cả những điều đó bị thách thức khi một cặp song sinh được sinh ra với thị giác.$https://motchillti.net/phim/thay-2.html
Hạnh Phúc Trong Tầm Tay$Full 45/45 Thuyết Minh$Đang cập nhật$45 phút/tập$45 tập$Thuyết Minh$2020$Trung Quốc$Tình Cảm$Hạnh Phúc Trong Tầm Tay - Love Advanced Customization (2020) Full VietSub HD$https://motchillti.net/phim/hanh-phuc-trong-tam-tay.html
Sóng Đại Dương$Full 01/01 Vietsub$Tomomi Mochizuki$72 phút$1 tập$Vietsub$1993$Nhật Bản$Tình Cảm, Chính kịch, Hoạt Hình$Sóng Đại Dương - Ocean Waves (1993) Full VietSub HD Là một phim nói về tình cảm lứa tuổi học trò, 72 phút của Ocean Waves trôi qua một cách lặng lẽ, để lại nhiều cảm xúc, làm cho người xem hồi tưởng lại một thời cắp sách đến trường, một tình yêu chớm nở nhưng lại giữ kín trong tim, để rồi bất giác một lúc nào đó, ta lại nhớ đến một bóng hình...$https://motchillti.net/phim/song-dai-duong.html
Um Ano Inesquecível: Verão$Full Vietsub$Cris D'amato$101 Phút$1 Tập$Vietsub$2023$Brazil$Chính kịch, Tình Cảm$Um Ano Inesquecível: Verão - An Unforgettable Year: Summer (2023) Full VietSub HD$https://motchillti.net/phim/um-ano-inesquecivel-verao-887944445.html
Na Tra: Ma Đồng Quy Lai$Full VietSub$Wei Zhi$1 giờ 30 phút$1 Tập$VietSub$2024$Trung Quốc$Phiêu Lưu, Hành Động, Viễn Tưởng$Na Tra: Ma Đồng Quy Lai - Nezha: Demon Child is Back (2024) Full VietSub HD Long Vương dẫn theo Tứ Hải Long Vương dùng nước dìm Trần Đường Quan để ép Lý Tịnh giao nộp Na Tra. Na Tra tự vẫn khiến thân xác tiêu tan, Thái Ất muốn xây dựng đền thờ để giúp Na Tra tái sinh. Nhiên Đăng Đạo Nhân tặng Lý Tịnh tháp Linh Lung, nói rằng nếu Na Tra nhận hương khói mà không lập công, sẽ bị ma tâm phản phệ. Lý Tịnh không nỡ để Na Tra lầm đường lạc lối nên quyết định phá đền, khiến Na Tra hiểu lầm, trong khi đó, mẹ Na Tra và Thái Ất lén thờ phụng bài vị của Na Tra. Long Vương tấn công bất ngờ khi Na Tra tái sinh, mọi người đều bị đè dưới tháp. Cha con Lý Tịnh và Na Tra hiểu lầm nhau sâu sắc, trước sau đều có địch, vừa phải chiến đấu với nhau, vừa phải đề phòng Long tộc và quái vật trong tháp tấn công, nên quyết định tạm gác mâu thuẫn để thoát khỏi nơi nguy hiểm. Hai người tiến sâu vào trong tháp, gặp nhiều ảo cảnh, kẻ thù ẩn náu bên trong, liên tục tấn công khiến cha con Lý Tịnh kiệt sức. Cuối cùng, hai người bỏ qua hiềm khích, cùng nhau đánh bại Long Vương.$https://motchillti.net/phim/na-tra-ma-dong-quy-lai.html
Biệt Đội Nữ Cảnh Sát Áo Xanh$Tập 5 Vietsub$Đang cập nhật$54 phút/tập$10 Tập$Vietsub$2024$Mexico$Hình Sự, Chính kịch$Biệt Đội Nữ Cảnh Sát Áo Xanh - Women in Blue (2024) Full VietSub HD Năm 1971, bốn phụ nữ bất chấp những chuẩn mực cực kì bảo thủ và gia nhập lực lượng cảnh sát nữ đầu tiên của Mexico - chỉ để phát hiện ra rằng đó là một chiêu trò quảng bá nhằm đánh lạc hướng giới truyền thông khỏi một kẻ giết người hàng loạt. Khi số lượng thi thể ngày càng tăng, họ thỏa thuận với nhau đưa kẻ giết người ra trước công lí.$https://motchillti.net/phim/biet-doi-nu-canh-sat-ao-xanh-74848.html
Đại Đường Nữ Tuần Án$Full 36/36 VietSub$Ưu Tiểu Cương$45 phút/tập$36 Tập$VietSub$2011$Trung Quốc$Chính kịch, Cổ Trang$Đại Đường Nữ Tuần Án - Thunder Angel (2011) Full VietSub HD Nam diễn viên chính là Trần Hạo Dân và Chung Hần Đồng rất đẹp đôi cả về vóc dáng, tạo hình và diễn xuất ăn ý. Phim xoay quanh nữ hào kiệt Võ Tắc Thiên là một cung nữ nhỏ bé nhưng cô không vì thế mà an phận hay sợ sệt bọn ôn thần nắm quyền. Đại Đường Nữ Tuần Án là bộ phim cổ trang mang đậm tính chất phá án, mang lại trật tự công bằng xã hội của vị nữ quan tài trí Tạ Dao Hoàn, dưới triều đại của Võ Tắc Thiên. Phim khắc họa lên một người phụ nữa đầy tài ba lúc bấy giờ dưới triều đại Võ Tắc Thiên. Những người phụ nữ đã có cơ hội được làm quan, đem tài trí ra đóng góp cho đất nước. Tuy nhiên, do tư tưởng trọng nam khinh nữ còn in sâu, nên không ít nữ nhi tài đức hơn người vẫn chưa được nhìn nhận đúng.$https://motchillti.net/phim/dai-duong-nu-tuan-an-5696.html
Người ngoại tộc (Phần 3)$Hoàn Tất (13/13) Vietsub$Đang cập nhật$1g 3phút/tập$13 Tập$Vietsub$2017$Âu Mỹ$Hành Động, Phiêu Lưu, Chính kịch$Người ngoại tộc (Phần 3) - Outlander (Season 3) (2017) Full VietSub HD$https://motchillti.net/phim/nguoi-ngoai-toc-phan-3.html
Mỹ Nhân Đạo Chích$Full Vietsub$Lee Seung-jun$120 Phút$1 Tập$Vietsub$2023$Hàn Quốc$Hài Hước, Chính kịch$Mỹ Nhân Đạo Chích - Miss Fortune (2023) Full VietSub HD Ji-hye, một kẻ lừa đảo tài năng và xinh đẹp, sau những thành công trước đây, đang phải đối mặt với những thất bại và nhận ra những khuyết điểm của bản thân. Trong sự tuyệt vọng để thay đổi cuộc sống nhỏ bé của mình, trước khi bước sang tuổi nghỉ hưu, cô quyết định thực hiện một kế hoạch cuối cùng có thể đảo ngược tất cả: dụ dỗ con trai của một gia đình nghệ thuật giàu có để chiếm đoạt kho báu vàng giấu trong biệt thự bí mật. Với sự hỗ trợ của con gái Ju-young, họ đã thành công trong việc lừa dối gia đình và chiếm đoạt lòng tin. Tuy nhiên, cuộc chơi đã trở thành một cuộc chiến không hồi kết. Liệu Ji-hye và Ju-young có thể tìm ra kho báu huyền thoại và khởi đầu một cuộc sống mới, hay cuộc đối đầu này sẽ là kết thúc không lường trước được trong một cuộc hành trình đầy thách thức và sự đổi mới?$https://motchillti.net/phim/my-nhan-dao-chich-7669.html
