Karas: Lời Tiên Tri$Full 01/01 Vietsub$Keiichi Sato$85 phút$1 tập$Vietsub$2007$Nhật Bản$Viễn Tưởng, Hoạt Hình$Karas: Lời Tiên Tri - Karas: The Revelation (2007) Full VietSub HD Tiếp nối phần phim trước (Lời tiên tri) đã dừng lại, Otoha, Karas mới tìm cách báo thù Yakuza đã sát hại em trai anh và bỏ mặc anh cho đến chết. Trong khi đó, Karas cũ, Eko, chuẩn bị trút cơn thịnh nộ của mình lên những con người nhẹ dạ đang phá hoại thành phố của anh ta. Otoha, Yurine và Nue phải hợp lực nếu họ muốn ngăn chặn thảm họa này. Chứng kiến ​​​​kết luận sử thi! Những anh hùng này có thể cứu con người và bảo vệ ý chí của thành phố không? Tìm hiểu khi Lời tiên tri trở thành Khải huyền!$https://motchillti.net/phim/karas-loi-tien-tri.html
Chú Thuật Hồi Chiến 0$Full 01/01 Vietsub$Sunghoo Park$105 phút$1 tập$Vietsub$2021$Nhật Bản$Hành Động, Hoạt Hình$"Chú Thuật Hồi Chiến 0 - Jujutsu Kaisen 0: The Movie (2021) Full VietSub HD Cho những ai chưa biết, Jujutsu Kaisen 0 là là tập truyện ngắn ra mắt trước khi Chú Thuật Hồi Chiến được sáng tác. Trọng tâm câu chuyện xoay quanh nguyền sư đặc cấp Yuta Okkotsu trong thời gian anh ta mới vào học viện chú thuật.Theo nhiều dự đoán, Jujutsu Kaisen 0 được chuyển thể anime movie là ""bước mở đường"" cho những dự án Jujutsu Kaisen tiếp theo. Phần phim này sẽ giúp giải thích về các nhân vật chính, đặc biệt là những nguyền sư đặc cấp hiện tại."$https://motchillti.net/phim/chu-thuat-hoi-chien-0.html
Tơ Hồng$Full 01/01 Vietsub$Joseph Mateo$11 phút$1 tập$Vietsub$2021$Âu Mỹ$Tình Cảm, Viễn Tưởng, Hoạt Hình$Tơ Hồng - Blush (2021) Full VietSub HD Tơ Hồng kể về một phi hành gia làm vườn bị mắc kẹt gặp một vị khách thanh tao trên một hành tinh lùn hoang vắng.$https://motchillti.net/phim/to-hong.html
Celestial Method$Full 01/01 Vietsub$Đang cập nhật$45 Phút/Tập$1 tập$Vietsub$2014$Nhật Bản$Hoạt Hình$Celestial Method - Sora No Method (2014) Full VietSub HD Komiya Nonoka, một cô gái đã từng sống tại thị trấn hồ Kiriya, tại đây cô đã gặp một cô gái tóc xanh tên Noel. Bảy năm sau, khi Nonoka quay trở về lần nữa thì thị trấn lúc này đã có một vật hình đĩa lơ lửng trên bầu trời. Và khi gặp lại Noel, Noel nói giờ đến lượt Noel sẽ thực hiện lời hứa thành hiện thực.$https://motchillti.net/phim/celestial-method.html
Người Nhận: Gerard$Full 01/01 Vietsub$Taylor Meacham$7 phút$1 tập$Vietsub$2020$Âu Mỹ$Chính kịch, Gia Đình, Hoạt Hình$Người Nhận: Gerard - To: Gerard (2020) Full VietSub HD Trước khi kết thúc ca làm việc của mình, một người đưa thư nhanh nhẹn sắp xếp các phong bì và gói hàng một cách nhanh nhẹn chỉ bằng cái lướt nhẹ của cổ tay. Mặc dù làm việc trong bưu điện cả đời, Gerard vẫn mơ ước một ngày nào đó sẽ tìm thấy đối tượng của mình là một ảo thuật gia nổi tiếng như anh hùng thời thơ ấu của anh. Với sự khéo léo không ngừng nghỉ đi kèm với sự thành thạo, đứa trẻ trưởng thành vui vẻ này thực hành phép thuật mỗi ngày với một đồng xu đặc biệt ... một món quà từ The Great Vivonti. Khi một cô gái trẻ tò mò tên là Jules lang thang theo thói quen thường ngày của anh ấy, cô ấy đã bị lóa mắt bởi tài năng của anh ấy. Với sự giúp đỡ của đồng xu yêu quý của mình, Gerard đã thu hút khán giả đầu tiên của mình bằng một màn ảo thuật ngẫu hứng. Vào thời điểm này, hai nghệ sĩ cách nhau hàng chục năm vô tình gây ra một phản ứng dây chuyền sẽ thay đổi cuộc đời của cả hai mãi mãi.$https://motchillti.net/phim/nguoi-nhan-gerard.html
Roujin Z$Full 01/01 Vietsub$Hiroyuki Kitakubo$80 phút$1 tập$Vietsub$1991$Nhật Bản$Chính kịch, Viễn Tưởng, Hoạt Hình$Roujin Z - Old Man Z (1991) Full VietSub HD Nội dung trong phim Roujin Z nhằm mục đích giúp thế hệ mới không phải quan tâm đến thế hệ cũ. Mối quan hệ ban đầu là tạo ra một cỗ máy chăm sóc chúng mà không cần bất kỳ sự can thiệp nào. Thoạt nhìn, nó trông giống như một kế hoạch tuyệt vời, và nhiều người trong thế hệ trẻ đã chấp thuận ứng dụng của nó. Nhưng khi ông già Takazawa trở thành đối tượng thử nghiệm cho cỗ máy Z-001, Haruko đặt câu hỏi về cả chiến thuật của bệnh viện và ý nghĩa đạo đức của cỗ máy.$https://motchillti.net/phim/roujin-z.html
Học Viện Phù Thùy Nhỏ: Cuộc Diễu Hành$Full 01/01 Vietsub$Yoh Yoshinari$55 phút$1 tập$Vietsub$2015$Nhật Bản$Hài Hước, Hành Động, Viễn Tưởng, Hoạt Hình$Học Viện Phù Thùy Nhỏ: Cuộc Diễu Hành - Little Witch Academia: Mahou Shikake No Parade (2015) Full VietSub HD Akko hậu đậu liên tục gây họa khiến cô hiệu phó nổi giận và phạt nhóm bạn phải tham gia đoàn diễu hành ngày lễ văn hóa ở thị trấn của con người. Sau khi biết buổi diễu hành nhằm tái hiện lạ quá khứ khi phù thủy bị ghét bỏ, Akko lập kế hoạch thay đổi truyền thống cổ hủ này bằng cách biến nó thành buổi diễu hành tuyệt vời nhất mọi thời đại.$https://motchillti.net/phim/hoc-vien-phu-thuy-nho-cuoc-dieu-hanh.html
Những Cô Nàng Nóng Bỏng 1$Full 10/10 Vietsub$Anu Menon$60 phút/tập$10$Vietsub$2019$Ấn Độ$Tình Cảm, Hài Hước, Chính kịch$Những Cô Nàng Nóng Bỏng 1 - Four More Shots Please! season 1 (2019) Full VietSub HD Kể về câu chuyện của bốn người phụ nữ không ngần ngại thừa nhận khuyết điểm của mình (hai người ở độ tuổi 30 và hai người ở đầu 20) khi họ sống, yêu, mắc sai lầm và khám phá ra điều thực sự thúc đẩy họ thông qua tình bạn và những ly tequila ở Mumbai của thế hệ Millennials. Đây là bộ phim Ấn Độ đầu tiên của Amazon Prime Video với toàn bộ dàn diễn viên chính là nữ, với sự tham gia của Sayani Gupta, Bani J, Kirti Kulhari, và Maanvi Gagroo.$https://motchillti.net/phim/nhung-co-nang-nong-bong-1.html
Những Cô Nàng Nóng Bỏng 2$Full 10/10 Vietsub$Nupur Asthana$60 phút/tập$10$Vietsub$2020$Ấn Độ$Tình Cảm, Hài Hước, Chính kịch$Những Cô Nàng Nóng Bỏng 2 - Four More Shots Please! (season 2) (2020) Full VietSub HD Kể về câu chuyện của bốn người phụ nữ không ngần ngại thừa nhận khuyết điểm của mình (hai người ở độ tuổi 30 và hai người ở đầu 20) khi họ sống, yêu, mắc sai lầm và khám phá ra điều thực sự thúc đẩy họ thông qua tình bạn và những ly tequila ở Mumbai của thế hệ Millennials. Đây là bộ phim Ấn Độ đầu tiên của Amazon Prime Video với toàn bộ dàn diễn viên chính là nữ, với sự tham gia của Sayani Gupta, Bani J, Kirti Kulhari, và Maanvi Gagroo.$https://motchillti.net/phim/nhung-co-nang-nong-bong-2.html
Gia đình nhà Claus 2$Full 01/01 Vietsub$Ruben Vandenborre$98 Phút$1 tập$Vietsub$2021$Anh$Tình Cảm, Gia Đình$Gia đình nhà Claus 2 - The Claus Family 2 (2021) Full VietSub HD Công việc của Santa là gì? Trao quà. Nhưng khi Jules đảm nhiệm công việc của người ông Noël, anh nhận được lá thư của một bé gái kèm theo lời ước đặc biệt cho ngày lễ.$https://motchillti.net/phim/gia-dinh-nha-claus-2.html
Gửi Đến Bạn Hiền 3$Full 06/06 Vietsub$Đang cập nhật$25 phút/tập$6$Vietsub$2024$Nhật Bản$Tình Cảm, Chính kịch, Hoạt Hình$Gửi Đến Bạn Hiền 3 - From Me to You: Kimi ni Todoke season 3 (2024) Full VietSub HD Cặp đôi mới Sawako và Kazehaya nếm hương vị buổi hẹn hò đầu tiên, chuyến đi dã ngoại đầu tiên ở trường, v.v. Trong khi đó, câu chuyện tình yêu của bạn bè họ cũng bắt đầu hé lộ.$https://motchillti.net/phim/gui-den-ban-hien-3.html
Dhevaprom: Dujupsorn$Full 15/15 Vietsub$Wun Songsak Mongkolthong$70 phút/tập$15$Vietsub$2024$Thái Lan$Tình Cảm, Chính kịch$Dhevaprom: Dujupsorn - Dhevaprom: Dujupsorn (2024) Full VietSub HD Cô gái trẻ nọ âm mưu trả thù gia đình của người đàn ông giàu có đã phản bội tình yêu của mẹ mình. Nhưng rốt cuộc cô lại vướng vào một chuyện tình nguy hiểm.$https://motchillti.net/phim/dhevaprom-dujupsorn.html
Người Vợ Nguy Hiểm Của Tôi 2016$Full 10/10 Vietsub$Miyake Yoshishige, Kunimoto Masahiro$45 Phút/Tập$10$Vietsub$$Nhật Bản$Tình Cảm, Tâm Lý$Người Vợ Nguy Hiểm Của Tôi 2016 - My Dangerous Wife () Full VietSub HD Mochizuki Kohei kết hôn với Maria - cô con gái xinh đẹp và tài năng của gia đình giàu có. Sau khi kết hôn, Kohei đã nghỉ việc tại công ty quảng cáo quy mô để về điều hành một quán cà phê và dường như mọi việc đang diễn ra vô cùng tốt đẹp. Mặc dù bề ngoài Kohei luôn tỏ ra là một người chồng hoàn hảo, nhưng sâu bên trong anh ta luôn cảm thấy ngột ngạt với sự hạn chế của vợ, cùng với âm mưu giết người dưới sự xúi giục của người tình kiêm đối tác quán cà phê của anh ta là Anna. Tuy nhiên tình hình có thay đổi lớn khi Kohei quyết định sẽ giết Maria. Lúc anh ta trở về nhà thì Maria đã bị bắt cóc và kẻ bắt cóc đã đòi một khoản tiền chuộc rất lớn. Mọi thứ càng trở nên tồi tệ hơn khi Kohei bị coi là nghi phạm của vụ bắt cóc. Lúc này, bộ mặt thật đáng sợ của Maria mà Kohei không hề biết đến dần dần lộ ra.$https://motchillti.net/phim/nguoi-vo-nguy-hiem-cua-toi-2016.html
Nữ Hoàng Cleopatra$Full 02/02 Vietsub$Joseph L. Mankiewicz$192 phút$2$Vietsub$1963$Quốc Gia Khác$Tình Cảm, Chiến Tranh$Nữ Hoàng Cleopatra - Cleopatra (1963) Full VietSub HD Nữ hoàng Cleopatra VII của Ai Cập trải qua cả chiến thắng và bi kịch khi cố gắng chống lại tham vọng đế quốc của La Mã.$https://motchillti.net/phim/nu-hoang-cleopatra.html
Nụ hôn tinh nghịch 2: Tình yêu ở Tokyo$Full 16/16 Vietsub$Kazuya Konaka, Takashi Ninomiya$45 Phút/Tập$16 Tập$Vietsub$2015$Nhật Bản$Tình Cảm, Hài Hước$Nụ hôn tinh nghịch 2: Tình yêu ở Tokyo - Mischievous Kiss 2: Love in Tokyo (2015) Full VietSub HD Kotoko ( Honoka Yahagi ) yêu Naoki ( Yuki Furukawa ) trong 6 năm và cuối cùng đã kết hôn với anh. Bây giờ, Kotoko chuyển sang khoa điều dưỡng để học tập và đấu tranh…$https://motchillti.net/phim/nu-hon-tinh-nghich-2-tinh-yeu-o-tokyo.html
Sugar Dog Life$tập 4 Vietsub$Đang cập nhật$30 Phút / Tập$10$Vietsub$2024$Thái Lan, Nhật Bản$Tình Cảm$"Sugar Dog Life - Sugar Dog Life (2024) Full VietSub HD Một câu chuyện tình yêu đan xen giữa Sakuraba Isumi, một sinh viên đại học thấp bé, mặt trẻ con, nấu ăn rất giỏi, và Amasawa Kyosuke, một cảnh sát cao ráo, chân thành với nét quyến rũ tự nhiên, dễ tính. Isumi hai mươi tuổi bị nhầm là trẻ vị thành niên và suýt bị Amasawa bắt giữ. Sau đó, Isumi lại tình cờ gặp Amasawa tại cửa hàng tiện lợi nơi anh làm việc bán thời gian. Từ đó trở đi, mỗi lần gặp nhau, Amasawa đều nhờ anh giới thiệu những món ăn nhẹ vào đêm khuya. Lo lắng về thói quen ăn uống của Amasawa, Isumi đề nghị, ""Hay là em đến nấu ăn cho anh nhé?"" Đến thăm nhà Amasawa, họ trở nên gần gũi hơn thông qua những bữa ăn tự nấu."$https://motchillti.net/phim/sugar-dog-life.html
Nhật Ký Ma Cà Rồng (Phần 8)$Full 16/16 Vietsub$Chris Grismer, Joshua Butler$43phút$16 Tập$Vietsub$2016$Quốc Gia Khác$Tâm Lý, Kinh Dị$Nhật Ký Ma Cà Rồng (Phần 8) - The Vampire Diaries Season 8 (2016) Full VietSub HD$https://motchillti.net/phim/nhat-ky-ma-ca-rong-phan-8.html
Long Môn Phi Giáp$Full Vietsub$Hark Tsui$1 giờ 30phút$1 Tập$Vietsub$2011$Trung Quốc$Hành Động, Cổ Trang, Phiêu Lưu$Long Môn Phi Giáp - The Flying Swords of Dragon Gate (2011) Full VietSub HD$https://motchillti.net/phim/long-mon-phi-giap.html
Băng Trộm Xuyên Thời Gian$Full 10/10 VietSub$Đang cập nhật$36 phút/tập$10 Tập$VietSub$2024$Âu Mỹ, Anh$Hành Động, Hài Hước, Viễn Tưởng, Phiêu Lưu, Khoa Học$Băng Trộm Xuyên Thời Gian - Time Bandits (2024) Full VietSub HD Niềm đam mê lịch sử của cậu bé Kevin 11 tuổi bị thử thách khi cậu tham gia nhóm trộm rách rưới du hành xuyên thời gian trong cuộc phiêu lưu đầy rủi ro và vui nhộn.$https://motchillti.net/phim/bang-trom-xuyen-thoi-gian-74858.html
Ngạ Quỷ: Tiếng Thét Đồng Gió Hú$Full Thuyết Minh$Chalerm Wongphim$90 phút$1 Tập$Thuyết Minh$2020$Thái Lan$Hành Động, Viễn Tưởng, Phiêu Lưu, Khoa Học, Kinh Dị, Bí ẩn$Ngạ Quỷ: Tiếng Thét Đồng Gió Hú - The Ghoul: Horror At The Howling Field (2020) Full VietSub HD$https://motchillti.net/phim/nga-quy-tieng-thet-dong-gio-hu.html
Tây Du Ký 3: Nữ Nhi Quốc$Full Thuyết Minh$Soi Cheang$1 giờ 30phút$1 Tập$Thuyết Minh$2018$Trung Quốc$Cổ Trang, Tâm Lý, Võ Thuật, Gia Đình, Bí ẩn$Tây Du Ký 3: Nữ Nhi Quốc - The Monkey King 3: Kingdom of Women (2018) Full VietSub HD$https://motchillti.net/phim/tay-du-ky-3-nu-nhi-quoc.html
Đại Mộng Tây Du 3: Kỳ Ngộ Nữ Nhi Quốc$Full Thuyết Minh$Mã Vân$1 giờ 30phút$1 Tập$Thuyết Minh$2017$Trung Quốc$Tình Cảm$Đại Mộng Tây Du 3: Kỳ Ngộ Nữ Nhi Quốc - The Dream Journey 3: The Land Of Many Perfumes (2017) Full VietSub HD$https://motchillti.net/phim/giac-mong-tay-du-3-ky-ngo-nu-nhi-quoc.html
Âm Dương Thủ Sơn Nhân$Full VietSub$Yao Da Xian$1 giờ 30phút$1 Tập$VietSub$2024$Trung Quốc$Kinh Dị, Phiêu Lưu, Bí ẩn$Âm Dương Thủ Sơn Nhân - Mountain Guardians (2024) Full VietSub HD Trong những năm đầu của thời kỳ Dân Quốc, khi quân phiệt tàn bạo gieo rắc nỗi kinh hoàng, yêu ma quỷ quái ngang nhiên hoành hành khắp nơi. Nhật Bản dòm ngó lãnh thổ Trung Hoa, đẩy mạnh kế hoạch xâm lược, và dưới lớp vỏ bọc giao lưu văn hóa, họ đã cử Âm Dương Sư mang theo một sứ mệnh bí ẩn vào đất Trung Hoa. Mục tiêu của họ là tìm kiếm long mạch thiêng liêng, phá hoại phong thủy của Hoa Hạ để mở đường cho cuộc xâm lược đầy tham vọng. Tuy nhiên, âm mưu này không qua mắt được nhóm đạo sĩ dân gian Trung Quốc, đứng đầu là Thất thúc. Với lòng yêu nước và ý chí bảo vệ dân tộc, họ đã đứng lên chống lại những mưu đồ thâm độc của Âm Dương Sư Nhật Bản, dấn thân vào một cuộc chiến cam go giữa chính nghĩa và tà ác, quyết tâm bảo vệ long mạch và gìn giữ đất nước trước nguy cơ bị xâm lược...$https://motchillti.net/phim/am-duong-thu-son-nhan-7489669.html
Tuyệt Mệnh Vô Thường Trấn$Full VietSub$Zhang Tian Hu$1 giờ 30phút$1 Tập$VietSub$2024$Trung Quốc$Kinh Dị, Bí ẩn$Tuyệt Mệnh Vô Thường Trấn - Death Town (2024) Full VietSub HD Tuyệt Mệnh Vô Thường Trấn, Trấn Vô Thường, một vùng đất yên bình đã nhiều năm xa rời chiến tranh, bỗng dưng bị bao trùm bởi bóng đen của hàng loạt cái chết bí ẩn. Cuộc sống vốn dĩ êm đềm nay bị xáo trộn bởi những sự kiện kinh hoàng và đầy bất ngờ. Đội trưởng đội cảnh sát Trần Mặc, trong quá trình điều tra, đã cứu sống một cô gái trẻ tên Bạch Sương khỏi chết đuối. Kể từ đó, Bạch Sương trở thành người đồng hành đặc biệt của anh. Nhờ sự hợp tác của cô, họ nhiều lần đối mặt với nguy hiểm cận kề cái chết, nhưng bằng cách nào đó, luôn thoát khỏi nanh vuốt của tử thần trong gang tấc. Liệu những cái chết này là do sức mạnh tự nhiên không thể kiểm soát hay là âm mưu đen tối của con người đang dần lộ diện?$https://motchillti.net/phim/tuyet-menh-vo-thuong-tran-7485969.html
Sự Tiến Hóa$Full 01/01 Vietsub$Ivan Reitman$101 phút$1 tập$Vietsub$2001$Quốc Gia Khác$Hài Hước, Viễn Tưởng$Sự Tiến Hóa - Evolution (2001) Full VietSub HD Evolution là một bộ phim hài khoa học viễn tưởng của Mỹ năm 2001 do Ivan Reitman đạo diễn. Phim có sự tham gia của David Duchovny, Orlando Jones, Seann William Scott, Julianne Moore và Ted Levine..$https://motchillti.net/phim/su-tien-hoa.html
Hồ Cá Sấu 2$Full 01/01 Vietsub$David Flores$88 phút$1 tập$Vietsub$2007$Canada$Kinh Dị, Viễn Tưởng$Hồ Cá Sấu 2 - Lake Placid 2 (2007) Full VietSub HD Lake Placid 2 là một bộ phim kinh dị hài được sản xuất cho truyền hình của Mỹ năm 2007 do David Flores đạo diễn. Đây là phần tiếp theo của Lake Placid và là phần thứ hai trong loạt phim, kể về câu chuyện của những con cá sấu ăn thịt người đã khủng bố cộng đồng địa phương.$https://motchillti.net/phim/ho-ca-sau-2.html
Hồ Cá Sấu 3$Full 01/01 Vietsub$Griff Furst$93 phút$1 tập$Vietsub$2010$Âu Mỹ$Kinh Dị, Hành Động, Viễn Tưởng$Hồ Cá Sấu 3 - Lake Placid 3 (2010) Full VietSub HD Câu chuyện bắt đầu khi một gia đình có trang trại gần bờ hồ phát hiện trong hồ có một con cá sấu khác thường. Họ cố cảnh báo cho cảnh sát địa phương biết nhưng không ai tin họ. Một ngày nọ, con cá sấu khổng lồ lên bờ và tàn sát hết gia đình đó, sau đó nó bắt đầu tấn công sang những người xung quanh. Mối đe dọa này ngày càng trở nên nguy hiểm.$https://motchillti.net/phim/ho-ca-sau-3.html
Hồ Cá Sấu$Full 01/01 Vietsub$Steve Miner$82 phút$1 tập$Vietsub$1999$Âu Mỹ$Hài Hước, Kinh Dị, Viễn Tưởng$Hồ Cá Sấu - Lake Placid (1999) Full VietSub HD Những nhà thám hiểm đã phá vỡ hàng rào ranh giới giữa khu vực an toàn và “địa bàn” cá sấu ở khu bảo tồn sinh thái, mở lối cho loài sinh vật khát máu tấn công những bạn trẻ đang tổ chức cắm trại gần đó. Cuộc rượt đuổi của kẻ săn mồi và con mồi bắt đầu.$https://motchillti.net/phim/ho-ca-sau.html
3% 1$Full 08/08 Vietsub$Đang cập nhật$50 phút/tập$8$Vietsub$2016$$Hài Hước, Hành Động, Viễn Tưởng$3% 1 - 3% Season 1 (2016) Full VietSub HD Trong một tương lai nơi giới thượng lưu sống ở một hòn đảo thiên đường cách xa khu ổ chuột đông đúc, bạn có một cơ hội để gia nhập 3% người được thoát khỏi đói nghèo.$https://motchillti.net/phim/3-1.html
3% 2$Full 10/10 Vietsub$Đang cập nhật$49 phút/tập$10$Vietsub$2019$Brazil$Chính kịch, Hành Động, Viễn Tưởng$3% 2 - 3% Season 2 (2019) Full VietSub HD Khi Quá trình tiếp theo ngày càng đến gần, Sự nghiệp lên kế hoạch táo bạo để xóa bỏ nghi lễ vĩnh viễn và Michele nhận ra mình đang ở trong một tình thế nguy hiểm.$https://motchillti.net/phim/3-2.html
3% 3$Full 08/08 Vietsub$Đang cập nhật$49 phút/tập$8$Vietsub$2019$Brazil$Chính kịch, Hành Động, Viễn Tưởng$3% 3 - 3% Season 3 (2019) Full VietSub HD Michele xây dựng một nơi cư trú yên bình ở Nội địa cho mọi người, nhưng khi cuộc khủng hoảng ập đến, cô buộc lòng phải đưa ra quy trình lựa chọn riêng.$https://motchillti.net/phim/3-3.html
3% 4$Full 07/07 Vietsub$Đang cập nhật$49 phút/tập$7$Vietsub$2020$Brazil$Chính kịch, Hành Động, Viễn Tưởng$3% 4 - 3% (Season 4) (2020) Full VietSub HD Được triệu tập đến khu vực Ngoài khơi trong sứ mệnh ngoại giao, Joana và cả nhóm ấp ủ kế hoạch gây rối với sự trợ giúp của Michele và một ứng viên mới của Quá Trình.$https://motchillti.net/phim/3-4.html
Bakuryuu Sentai Abaranger 20th: The Unforgivable Abare$Full 01/01 Vietsub$Hisashi Kimura$59 phút$1 tập$Vietsub$2023$Nhật Bản$Chính kịch, Phiêu Lưu, Hành Động, Viễn Tưởng$Bakuryuu Sentai Abaranger 20th: The Unforgivable Abare - Bakuryuu Sentai Abaranger 20th: The Unforgivable Abare (2023) Full VietSub HD 20 năm sau khi trận chiến với Evolians kết thúc, một mối đe dọa mới xuất hiện đe dọa nền hòa bình lâu dài mà Ryouga và những Abaranger khác đã tận hưởng. Lần đầu tiên sau một thời gian dài, họ biến hình để chiến đấu nhưng công chúng dường như nghĩ rằng hành động của họ là hành động tàn phá man rợ. Trong thời đại Reiwa, liệu công lý mà họ từng đấu tranh có được coi là một phong cách anh hùng lỗi thời không?$https://motchillti.net/phim/bakuryuu-sentai-abaranger-20th-the-unforgivable-abare.html
Siêu Giác Quan: Tập Đặc Biệt Giáng Sinh$Full 01/01 Vietsub$Lana Wachowski$60 phút/tập$1 tập$Vietsub$2016$Âu Mỹ$Chính kịch, Viễn Tưởng$Siêu Giác Quan: Tập Đặc Biệt Giáng Sinh - Sense8: A Christmas Special (2016) Full VietSub HD$https://motchillti.net/phim/sieu-giac-quan-tap-dac-biet-giang-sinh.html
Sekai ga Horobiru Mae ni Kimi ni Aitai$Full 01/01 Vietsub$Pierre Ito$31 phút$1 tập$Vietsub$2021$Nhật Bản$Chính kịch, Viễn Tưởng, Hoạt Hình$Sekai ga Horobiru Mae ni Kimi ni Aitai - Sekai ga Horobiru Mae ni Kimi ni Aitai (2021) Full VietSub HD Hai người bị ngăn cách bởi thời gian và không gian phải làm sáng tỏ lịch sử rối rắm của họ trước khi thế giới đi đến hồi kết.$https://motchillti.net/phim/sekai-ga-horobiru-mae-ni-kimi-ni-aitai.html
Pháp Sư Mạnh Nhất Của Quân Đội Ma Vương Hóa Ra Lại Là Con Người$Tập 10 VietSub$Đang cập nhật$20 phút/tập$12 Tập$VietSub$2024$Nhật Bản$Hoạt Hình$"Pháp Sư Mạnh Nhất Của Quân Đội Ma Vương Hóa Ra Lại Là Con Người - Maougun Saikyou no Majutsushi wa Ningen datta (2024) Full VietSub HD ""Pháp sư mạnh nhất của Quân đội Ma vương"" Tôi được gọi. Ike, một con quỷ có khả năng một mình chiếm được pháo đài. Tiêu diệt kẻ thù bằng phép thuật to lớn, anh ta chắc chắn là một con quái vật được bạn bè và kẻ thù kính sợ. Tuy nhiên anh ta có một bí mật mà anh ta không thể nói với những con quỷ khác. ""Tôi, thực ra tôi là con người, bạn biết đấy."" Sử dụng kiến ​​thức hiện đại để giữ bí mật, anh được coi như một chỉ huy vĩ đại và là động lực của quân đội Ma vương."$https://motchillti.net/phim/phap-su-manh-nhat-cua-quan-doi-ma-vuong-hoa-ra-lai-la-con-nguoi-155869.html
Luật Sư Vô Pháp$Full 16/16 Vietsub$Jin Zhen Min$1H4M15S$16 Tập$Vietsub$2018$Hàn Quốc$Hành Động, Hình Sự, Bí ẩn$Luật Sư Vô Pháp - Lawless Lawyer (2018) Full VietSub HD$https://motchillti.net/phim/luat-su-vo-phap.html
Harold và Cây Bút Phép Thuật$Full Vietsub$Carlos Saldanha$90 Phút$1 Tập$Vietsub$2024$Âu Mỹ$Hài Hước, Phiêu Lưu, Gia Đình$Harold và Cây Bút Phép Thuật - Harold and the Purple Crayon (2024) Full VietSub HD Dựa trên bộ truyện nổi tiếng ra đời năm 1955, câu chuyện kể về Harold, một cậu bé 4 tuổi với trí tưởng tượng phi thường. Với cây bút chì màu tím kỳ diệu trong tay, Harold không chỉ vẽ nên những hình ảnh mà còn tạo ra cả một thế giới sống động xung quanh mình. Mỗi nét vẽ của Harold không đơn thuần là những đường nét vô hồn, mà chúng mở ra những cánh cửa dẫn lối vào những cuộc phiêu lưu kỳ thú. Trong Thế giới Thực mà Harold tự tay tạo nên, cậu và những người bạn của mình bước vào những cuộc hành trình mới lạ, đầy màu sắc và đầy bất ngờ. Từng trang truyện là một cuộc khám phá, nơi Harold không ngừng sáng tạo và tìm tòi, biến mỗi ngày trở thành một cuộc phiêu lưu đầy kịch tính và lôi cuốn. Với cây bút chì màu trong tay, thế giới của Harold trở nên vô hạn, nơi mọi ước mơ đều có thể thành hiện thực, và mỗi bước chân đều dẫn đến một vùng đất mới, nơi mà chỉ trí tưởng tượng có thể chạm tới.$https://motchillti.net/phim/harold-va-cay-but-phep-thuat-7488898.html
